kernel_benchmark/main_res_fixed.csv
M,K,N,SplitK,Sparsity,Kernel,Duration(ns),TFLOPS
8192,29568,8,7,40,SpInfer,2825.2,823.06461
8192,29568,8,7,40,cuBLAS_TC,1184850.9,1.96254
8192,29568,8,7,40,Flash-LLM,1714.1,1356.58488
8192,29568,8,7,50,SpInfer,2775.0,698.29494
8192,29568,8,7,50,cuBLAS_TC,1184755.6,1.63558
8192,29568,8,7,50,Flash-LLM,1696.6,1142.14809
8192,29568,8,7,60,SpInfer,2785.3,556.57012
8192,29568,8,7,60,cuBLAS_TC,1184888.9,1.30832
8192,29568,8,7,60,Flash-LLM,1685.0,920.00876
8192,29568,8,7,70,SpInfer,2746.4,423.34003
8192,29568,8,7,70,cuBLAS_TC,1184653.2,0.98144
8192,29568,8,7,70,Flash-LLM,1689.3,688.25020
8192,29568,16,7,40,SpInfer,2720.8,1709.29296
8192,29568,16,7,40,cuBLAS_TC,2350274.5,1.97877
8192,29568,16,7,40,Flash-LLM,1749.1,2658.87844
8192,29568,16,7,50,SpInfer,2743.3,1412.72806
8192,29568,16,7,50,cuBLAS_TC,2350704.8,1.64867
8192,29568,16,7,50,Flash-LLM,1682.8,2303.02882
8192,29568,16,7,60,SpInfer,2709.5,1144.28105
8192,29568,16,7,60,cuBLAS_TC,2350440.5,1.31908
8192,29568,16,7,60,Flash-LLM,1684.9,1840.12672
8192,29568,16,7,70,SpInfer,2737.2,849.52584
8192,29568,16,7,70,cuBLAS_TC,2350255.0,0.98939
8192,29568,16,7,70,Flash-LLM,1690.9,1375.19791
8192,29568,32,7,40,SpInfer,2723.8,3414.82067
8192,29568,32,7,40,cuBLAS_TC,242.7,38324.22147
8192,29568,32,7,40,Flash-LLM,1685.3,5519.06993
8192,29568,32,7,50,SpInfer,2730.0,2839.22117
8192,29568,32,7,50,cuBLAS_TC,243.7,31805.80136
8192,29568,32,7,50,Flash-LLM,1699.6,4560.52824
8192,29568,32,7,60,SpInfer,2705.4,2292.03040
8192,29568,32,7,60,cuBLAS_TC,243.7,25444.64109
8192,29568,32,7,60,Flash-LLM,1690.6,3667.84516
8192,29568,32,7,70,SpInfer,2720.8,1709.29296
8192,29568,32,7,70,cuBLAS_TC,245.8,18920.44050
8192,29568,32,7,70,Flash-LLM,1685.4,2759.37123
4096,4096,8,7,40,SpInfer,2657.3,60.61087
4096,4096,8,7,40,cuBLAS_TC,98845.7,1.62942
4096,4096,8,7,40,Flash-LLM,1711.1,94.12733
4096,4096,8,7,50,SpInfer,2742.3,48.94349
4096,4096,8,7,50,cuBLAS_TC,98093.1,1.36827
4096,4096,8,7,50,Flash-LLM,1698.8,79.00737
4096,4096,8,7,60,SpInfer,2661.4,40.34500
4096,4096,8,7,60,cuBLAS_TC,93358.1,1.15013
4096,4096,8,7,60,Flash-LLM,1711.1,62.75155
4096,4096,8,7,70,SpInfer,2727.9,29.52111
4096,4096,8,7,70,cuBLAS_TC,93625.3,0.86014
4096,4096,8,7,70,Flash-LLM,1697.8,47.43235
4096,4096,16,7,40,SpInfer,2630.7,122.44747
4096,4096,16,7,40,cuBLAS_TC,172227.6,1.87033
4096,4096,16,7,40,Flash-LLM,1689.6,190.65018
4096,4096,16,7,50,SpInfer,2635.8,101.84212
4096,4096,16,7,50,cuBLAS_TC,172687.4,1.55446
4096,4096,16,7,50,Flash-LLM,1688.6,158.96924
4096,4096,16,7,60,SpInfer,2674.7,80.28877
4096,4096,16,7,60,cuBLAS_TC,172066.8,1.24805
4096,4096,16,7,60,Flash-LLM,1694.7,126.71763
4096,4096,16,7,70,SpInfer,2729.0,59.01842
4096,4096,16,7,70,cuBLAS_TC,172513.3,0.93362
4096,4096,16,7,70,Flash-LLM,1720.3,93.62395
4096,4096,32,7,40,SpInfer,2645.0,243.57092
4096,4096,32,7,40,cuBLAS_TC,244.7,2632.79565
4096,4096,32,7,40,Flash-LLM,1679.4,383.61623
4096,4096,32,7,50,SpInfer,2632.7,203.92407
4096,4096,32,7,50,cuBLAS_TC,244.7,2193.99637
4096,4096,32,7,50,Flash-LLM,1692.7,317.16838
4096,4096,32,7,60,SpInfer,2630.7,163.26329
4096,4096,32,7,60,cuBLAS_TC,244.7,1755.19710
4096,4096,32,7,60,Flash-LLM,1724.4,249.07024
4096,4096,32,7,70,SpInfer,2620.4,122.92877
4096,4096,32,7,70,cuBLAS_TC,245.8,1310.50670
4096,4096,32,7,70,Flash-LLM,1676.3,192.16283
32000,5120,8,3,40,SpInfer,2688.0,585.14286
32000,5120,8,3,40,cuBLAS_TC,795571.2,1.97702
32000,5120,8,3,40,Flash-LLM,1705.0,922.50088
32000,5120,8,3,50,SpInfer,2693.1,486.69563
32000,5120,8,3,50,cuBLAS_TC,791638.0,1.65571
32000,5120,8,3,50,Flash-LLM,1696.7,772.51135
32000,5120,8,3,60,SpInfer,2702.3,388.03094
32000,5120,8,3,60,cuBLAS_TC,791229.4,1.32525
32000,5120,8,3,60,Flash-LLM,1698.4,617.39049
32000,5120,8,3,70,SpInfer,2690.0,292.35390
32000,5120,8,3,70,cuBLAS_TC,790777.8,0.99450
32000,5120,8,3,70,Flash-LLM,1694.4,464.13598
32000,5120,16,3,40,SpInfer,2672.6,1177.02911
32000,5120,16,3,40,cuBLAS_TC,1549691.9,2.02991
32000,5120,16,3,40,Flash-LLM,1690.9,1860.38678
32000,5120,16,3,50,SpInfer,2691.1,974.11467
32000,5120,16,3,50,cuBLAS_TC,1549324.4,1.69199
32000,5120,16,3,50,Flash-LLM,1703.4,1538.94564
32000,5120,16,3,60,SpInfer,2727.9,768.77891
32000,5120,16,3,60,cuBLAS_TC,1546615.9,1.35596
32000,5120,16,3,60,Flash-LLM,1691.5,1239.81791
32000,5120,16,3,70,SpInfer,2681.9,586.47377
32000,5120,16,3,70,cuBLAS_TC,1546024.0,1.01736
32000,5120,16,3,70,Flash-LLM,1680.7,935.83864
32000,5120,32,3,40,SpInfer,2680.8,2346.85765
32000,5120,32,3,40,cuBLAS_TC,244.7,25710.89497
32000,5120,32,3,40,Flash-LLM,1687.1,3729.15417
32000,5120,32,3,50,SpInfer,2677.8,1957.90574
32000,5120,32,3,50,cuBLAS_TC,302.1,17354.78318
32000,5120,32,3,50,Flash-LLM,1695.5,3092.23238
32000,5120,32,3,60,SpInfer,2699.3,1553.84878
32000,5120,32,3,60,cuBLAS_TC,255.0,16448.25098
32000,5120,32,3,60,Flash-LLM,1713.1,2448.37079
32000,5120,32,3,70,SpInfer,2678.8,1174.30491
32000,5120,32,3,70,cuBLAS_TC,244.7,12855.44749
32000,5120,32,3,70,Flash-LLM,1709.1,1840.57574
32000,8192,8,3,40,SpInfer,2705.4,930.20714
32000,8192,8,3,40,cuBLAS_TC,1190995.0,2.11301
32000,8192,8,3,40,Flash-LLM,1709.6,1472.02995
32000,8192,8,3,50,SpInfer,2730.0,768.18755
32000,8192,8,3,50,cuBLAS_TC,1184916.5,1.76987
32000,8192,8,3,50,Flash-LLM,1700.2,1233.47371
32000,8192,8,3,60,SpInfer,2724.9,615.70025
32000,8192,8,3,60,cuBLAS_TC,1183942.6,1.41706
32000,8192,8,3,60,Flash-LLM,1720.1,975.36283
32000,8192,8,3,70,SpInfer,2745.3,458.34379
32000,8192,8,3,70,cuBLAS_TC,1175738.5,1.07021
32000,8192,8,3,70,Flash-LLM,1675.1,751.17378
32000,8192,16,3,40,SpInfer,2696.2,1866.76241
32000,8192,16,3,40,cuBLAS_TC,2326264.0,2.16363
32000,8192,16,3,40,Flash-LLM,1701.2,2958.59676
32000,8192,16,3,50,SpInfer,2693.1,1557.42601
32000,8192,16,3,50,cuBLAS_TC,2326149.2,1.80311
32000,8192,16,3,50,Flash-LLM,1698.3,2469.70735
32000,8192,16,3,60,SpInfer,2698.2,1243.58580
32000,8192,16,3,60,cuBLAS_TC,2325398.5,1.44295
32000,8192,16,3,60,Flash-LLM,1705.9,1966.96360
32000,8192,16,3,70,SpInfer,2689.0,935.88040
32000,8192,16,3,70,cuBLAS_TC,2323948.5,1.08289
32000,8192,16,3,70,Flash-LLM,1699.8,1480.51677
32000,8192,32,3,40,SpInfer,2720.8,3699.76830
32000,8192,32,3,40,cuBLAS_TC,245.8,40953.33442
32000,8192,32,3,40,Flash-LLM,1689.2,5959.22898
32000,8192,32,3,50,SpInfer,2747.4,3053.28966
32000,8192,32,3,50,cuBLAS_TC,254.0,33026.01575
32000,8192,32,3,50,Flash-LLM,1690.4,4962.49882
32000,8192,32,3,60,SpInfer,2674.7,2509.02397
32000,8192,32,3,60,cuBLAS_TC,259.1,25900.75801
32000,8192,32,3,60,Flash-LLM,1692.0,3966.24492
32000,8192,32,3,70,SpInfer,2754.6,1827.18536
32000,8192,32,3,70,cuBLAS_TC,243.7,20653.11777
32000,8192,32,3,70,Flash-LLM,1689.9,2978.38026
28672,8192,8,4,40,SpInfer,2721.8,828.44361
28672,8192,8,4,40,cuBLAS_TC,1058360.4,2.13052
28672,8192,8,4,40,Flash-LLM,1694.0,1331.08491
28672,8192,8,4,50,SpInfer,2717.7,691.41119
28672,8192,8,4,50,cuBLAS_TC,1057477.8,1.77692
28672,8192,8,4,50,Flash-LLM,1710.2,1098.73009
28672,8192,8,4,60,SpInfer,2721.8,552.29574
28672,8192,8,4,60,cuBLAS_TC,1057467.5,1.42155
28672,8192,8,4,60,Flash-LLM,1703.3,882.54480
28672,8192,8,4,70,SpInfer,2708.5,416.25583
28672,8192,8,4,70,cuBLAS_TC,1050699.9,1.07303
28672,8192,8,4,70,Flash-LLM,1687.1,668.26443
28672,8192,16,4,40,SpInfer,2701.3,1669.46124
28672,8192,16,4,40,cuBLAS_TC,2087736.4,2.16010
28672,8192,16,4,40,Flash-LLM,1696.8,2657.77679
28672,8192,16,4,50,SpInfer,2708.5,1387.51943
28672,8192,16,4,50,cuBLAS_TC,2087943.1,1.79990
28672,8192,16,4,50,Flash-LLM,1680.3,2236.56275
28672,8192,16,4,60,SpInfer,2695.2,1115.49314
28672,8192,16,4,60,cuBLAS_TC,2086132.8,1.44117
28672,8192,16,4,60,Flash-LLM,1685.3,1783.94180
28672,8192,16,4,70,SpInfer,2725.9,827.19756
28672,8192,16,4,70,cuBLAS_TC,2083628.0,1.08218
28672,8192,16,4,70,Flash-LLM,1693.1,1331.79247
28672,8192,32,4,40,SpInfer,2712.6,3325.01339
28672,8192,32,4,40,cuBLAS_TC,244.7,36859.13903
28672,8192,32,4,40,Flash-LLM,1694.3,5323.39687
28672,8192,32,4,50,SpInfer,2687.0,2797.24331
28672,8192,32,4,50,cuBLAS_TC,244.7,30715.94919
28672,8192,32,4,50,Flash-LLM,1698.6,4424.93393
28672,8192,32,4,60,SpInfer,2692.1,2233.55530
28672,8192,32,4,60,cuBLAS_TC,244.7,24572.75936
28672,8192,32,4,60,Flash-LLM,1742.3,3451.15894
28672,8192,32,4,70,SpInfer,2756.6,1635.97028
28672,8192,32,4,70,cuBLAS_TC,244.7,18429.56952
28672,8192,32,4,70,Flash-LLM,1709.8,2637.56911
5120,5120,8,5,40,SpInfer,2713.6,92.73962
5120,5120,8,5,40,cuBLAS_TC,175159.3,1.43674
5120,5120,8,5,40,Flash-LLM,1703.9,147.69543
5120,5120,8,5,50,SpInfer,2698.2,77.72411
5120,5120,8,5,50,cuBLAS_TC,176244.7,1.18991
5120,5120,8,5,50,Flash-LLM,1708.0,122.78407
5120,5120,8,5,60,SpInfer,2718.7,61.71044
5120,5120,8,5,60,cuBLAS_TC,167953.4,0.99892
5120,5120,8,5,60,Flash-LLM,1676.3,100.08481
5120,5120,8,5,70,SpInfer,2701.3,46.58095
5120,5120,8,5,70,cuBLAS_TC,168428.5,0.74708
5120,5120,8,5,70,Flash-LLM,1683.5,74.74257
5120,5120,16,5,40,SpInfer,2703.4,186.17906
5120,5120,16,5,40,cuBLAS_TC,285052.9,1.76569
5120,5120,16,5,40,Flash-LLM,1707.0,294.85441
5120,5120,16,5,50,SpInfer,2723.8,153.98722
5120,5120,16,5,50,cuBLAS_TC,285459.4,1.46932
5120,5120,16,5,50,Flash-LLM,1686.5,248.69873
5120,5120,16,5,60,SpInfer,2702.3,124.16990
5120,5120,16,5,60,cuBLAS_TC,286842.8,1.16978
5120,5120,16,5,60,Flash-LLM,1711.1,196.09860
5120,5120,16,5,70,SpInfer,2716.7,92.63380
5120,5120,16,5,70,cuBLAS_TC,285120.5,0.88264
5120,5120,16,5,70,Flash-LLM,1698.8,148.13883
5120,5120,32,5,40,SpInfer,2642.9,380.88197
5120,5120,32,5,40,cuBLAS_TC,245.8,4095.33344
5120,5120,32,5,40,Flash-LLM,1678.3,599.79322
5120,5120,32,5,50,SpInfer,2657.3,315.68163
5120,5120,32,5,50,cuBLAS_TC,244.7,3428.11933
5120,5120,32,5,50,Flash-LLM,1696.8,494.37812
5120,5120,32,5,60,SpInfer,2657.3,252.54531
5120,5120,32,5,60,cuBLAS_TC,245.8,2730.22229
5120,5120,32,5,60,Flash-LLM,1720.3,390.09977
5120,5120,32,5,70,SpInfer,2673.7,188.24718
5120,5120,32,5,70,cuBLAS_TC,242.7,2073.82151
5120,5120,32,5,70,Flash-LLM,1705.0,295.20028
5120,13824,8,5,40,SpInfer,2825.2,240.50589
5120,13824,8,5,40,cuBLAS_TC,476255.2,1.42671
5120,13824,8,5,40,Flash-LLM,1723.4,394.26555
5120,13824,8,5,50,SpInfer,2753.5,205.64047
5120,13824,8,5,50,cuBLAS_TC,476367.9,1.18864
5120,13824,8,5,50,Flash-LLM,1685.5,335.94247
5120,13824,8,5,60,SpInfer,2751.5,164.63196
5120,13824,8,5,60,cuBLAS_TC,476241.9,0.95117
5120,13824,8,5,60,Flash-LLM,1709.1,265.04291
5120,13824,8,5,70,SpInfer,2718.7,124.96363
5120,13824,8,5,70,cuBLAS_TC,476453.9,0.71306
5120,13824,8,5,70,Flash-LLM,1686.5,201.44597
5120,13824,16,5,40,SpInfer,2683.9,506.33574
5120,13824,16,5,40,cuBLAS_TC,798141.4,1.70265
5120,13824,16,5,40,Flash-LLM,1693.7,802.35844
5120,13824,16,5,50,SpInfer,2693.1,420.50502
5120,13824,16,5,50,cuBLAS_TC,796939.2,1.42101
5120,13824,16,5,50,Flash-LLM,1699.8,666.23255
5120,13824,16,5,60,SpInfer,2708.5,334.49129
5120,13824,16,5,60,cuBLAS_TC,798775.2,1.13420
5120,13824,16,5,60,Flash-LLM,1722.4,525.99261
5120,13824,16,5,70,SpInfer,2696.2,252.01292
5120,13824,16,5,70,cuBLAS_TC,798122.0,0.85135
5120,13824,16,5,70,Flash-LLM,1696.8,400.44628
5120,13824,32,5,40,SpInfer,2709.5,1003.10352
5120,13824,32,5,40,cuBLAS_TC,247.8,10968.15574
5120,13824,32,5,40,Flash-LLM,1689.6,1608.61091
5120,13824,32,5,50,SpInfer,2694.1,840.69788
5120,13824,32,5,50,cuBLAS_TC,244.7,9255.92219
5120,13824,32,5,50,Flash-LLM,1691.6,1338.92419
5120,13824,32,5,60,SpInfer,2699.3,671.26267
5120,13824,32,5,60,cuBLAS_TC,244.7,7404.73775
5120,13824,32,5,60,Flash-LLM,1685.5,1075.01592
5120,13824,32,5,70,SpInfer,2681.9,506.71334
5120,13824,32,5,70,cuBLAS_TC,255.0,5329.23332
5120,13824,32,5,70,Flash-LLM,1683.5,807.21978
3584,20480,8,7,40,SpInfer,2739.2,257.24411
3584,20480,8,7,40,cuBLAS_TC,403123.2,1.74796
3584,20480,8,7,40,Flash-LLM,1692.7,416.28350
3584,20480,8,7,50,SpInfer,2737.2,214.52673
3584,20480,8,7,50,cuBLAS_TC,403078.2,1.45680
3584,20480,8,7,50,Flash-LLM,1693.7,346.69809
3584,20480,8,7,60,SpInfer,2750.5,170.79151
3584,20480,8,7,60,cuBLAS_TC,403661.8,1.16375
3584,20480,8,7,60,Flash-LLM,1695.7,277.03134
3584,20480,8,7,70,SpInfer,2752.5,128.00056
3584,20480,8,7,70,cuBLAS_TC,403210.2,0.87379
3584,20480,8,7,70,Flash-LLM,1731.6,203.46589
3584,20480,16,7,40,SpInfer,2690.0,523.89819
3584,20480,16,7,40,cuBLAS_TC,800998.4,1.75941
3584,20480,16,7,40,Flash-LLM,1698.8,829.57743
3584,20480,16,7,50,SpInfer,2708.5,433.59982
3584,20480,16,7,50,cuBLAS_TC,801596.4,1.46508
3584,20480,16,7,50,Flash-LLM,1698.8,691.31453
3584,20480,16,7,60,SpInfer,2675.7,351.13208
3584,20480,16,7,60,cuBLAS_TC,802343.9,1.17097
3584,20480,16,7,60,Flash-LLM,1675.3,560.80946
3584,20480,16,7,70,SpInfer,2742.3,256.95331
3584,20480,16,7,70,cuBLAS_TC,801161.2,0.87953
3584,20480,16,7,70,Flash-LLM,1683.5,418.55840
3584,20480,32,7,40,SpInfer,2719.7,1036.35412
3584,20480,32,7,40,cuBLAS_TC,244.7,11518.48095
3584,20480,32,7,40,Flash-LLM,1757.2,1604.01337
3584,20480,32,7,50,SpInfer,2715.6,864.93233
3584,20480,32,7,50,cuBLAS_TC,243.7,9638.12162
3584,20480,32,7,50,Flash-LLM,1706.0,1376.79381
3584,20480,32,7,60,SpInfer,2724.9,689.58428
3584,20480,32,7,60,cuBLAS_TC,244.7,7678.98730
3584,20480,32,7,60,Flash-LLM,1699.8,1105.45252
3584,20480,32,7,70,SpInfer,2692.1,523.48952
3584,20480,32,7,70,cuBLAS_TC,248.8,5664.33338
3584,20480,32,7,70,Flash-LLM,1706.0,826.07629
4096,11008,8,7,40,SpInfer,2709.5,159.75352
4096,11008,8,7,40,cuBLAS_TC,236035.1,1.83385
4096,11008,8,7,40,Flash-LLM,1685.5,256.80936
4096,11008,8,7,50,SpInfer,2712.6,132.97580
4096,11008,8,7,50,cuBLAS_TC,233825.3,1.54265
4096,11008,8,7,50,Flash-LLM,1693.7,212.97169
4096,11008,8,7,60,SpInfer,2717.7,106.18100
4096,11008,8,7,60,cuBLAS_TC,233438.2,1.23616
4096,11008,8,7,60,Flash-LLM,1695.7,170.17640
4096,11008,8,7,70,SpInfer,2724.9,79.42533
4096,11008,8,7,70,cuBLAS_TC,233161.7,0.92822
4096,11008,8,7,70,Flash-LLM,1688.6,128.16895
4096,11008,16,7,40,SpInfer,2657.3,325.78344
4096,11008,16,7,40,cuBLAS_TC,449870.8,1.92434
4096,11008,16,7,40,Flash-LLM,1696.8,510.19822
4096,11008,16,7,50,SpInfer,2671.6,270.03305
4096,11008,16,7,50,cuBLAS_TC,449157.2,1.60616
4096,11008,16,7,50,Flash-LLM,1691.6,426.47215
4096,11008,16,7,60,SpInfer,2669.6,216.18828
4096,11008,16,7,60,cuBLAS_TC,449420.3,1.28418
4096,11008,16,7,60,Flash-LLM,1692.7,340.95601
4096,11008,16,7,70,SpInfer,2670.6,162.08050
4096,11008,16,7,70,cuBLAS_TC,449347.6,0.96329
4096,11008,16,7,70,Flash-LLM,1685.5,256.80936
4096,11008,32,7,40,SpInfer,2684.9,644.86897
4096,11008,32,7,40,cuBLAS_TC,248.8,6959.03815
4096,11008,32,7,40,Flash-LLM,1692.7,1022.86802
4096,11008,32,7,50,SpInfer,2689.0,536.57143
4096,11008,32,7,50,cuBLAS_TC,245.8,5869.97793
4096,11008,32,7,50,Flash-LLM,1691.6,852.94430
4096,11008,32,7,60,SpInfer,2678.8,430.89162
4096,11008,32,7,60,cuBLAS_TC,244.7,4717.09220
4096,11008,32,7,60,Flash-LLM,1683.5,685.63853
4096,11008,32,7,70,SpInfer,2690.0,321.82318
4096,11008,32,7,70,cuBLAS_TC,252.9,3423.10931
4096,11008,32,7,70,Flash-LLM,1739.8,497.58843
13824,5120,8,3,40,SpInfer,2768.9,245.39610
13824,5120,8,3,40,cuBLAS_TC,370725.9,1.83283
13824,5120,8,3,40,Flash-LLM,1686.5,402.89193
13824,5120,8,3,50,SpInfer,2751.5,205.78995
13824,5120,8,3,50,cuBLAS_TC,371490.8,1.52421
13824,5120,8,3,50,Flash-LLM,1695.7,333.92171
13824,5120,8,3,60,SpInfer,2823.2,160.45085
13824,5120,8,3,60,cuBLAS_TC,371156.0,1.22047
13824,5120,8,3,60,Flash-LLM,1712.1,264.57849
13824,5120,8,3,70,SpInfer,2724.9,124.67930
13824,5120,8,3,70,cuBLAS_TC,370469.9,0.91705
13824,5120,8,3,70,Flash-LLM,1711.1,198.54984
13824,5120,16,3,40,SpInfer,2700.3,503.26056
13824,5120,16,3,40,cuBLAS_TC,687047.7,1.97796
13824,5120,16,3,40,Flash-LLM,1715.2,792.30090
13824,5120,16,3,50,SpInfer,2703.4,418.90289
13824,5120,16,3,50,cuBLAS_TC,687622.1,1.64693
13824,5120,16,3,50,Flash-LLM,1686.5,671.48656
13824,5120,16,3,60,SpInfer,2718.7,333.23635
13824,5120,16,3,60,cuBLAS_TC,685871.1,1.32090
13824,5120,16,3,60,Flash-LLM,1713.2,528.81722
13824,5120,16,3,70,SpInfer,2712.6,250.48929
13824,5120,16,3,70,cuBLAS_TC,685874.2,0.99067
13824,5120,16,3,70,Flash-LLM,1685.5,403.13097
13824,5120,32,3,40,SpInfer,2744.3,990.38334
13824,5120,32,3,40,cuBLAS_TC,244.7,11107.10663
13824,5120,32,3,40,Flash-LLM,1715.2,1584.60179
13824,5120,32,3,50,SpInfer,2707.5,836.53709
13824,5120,32,3,50,cuBLAS_TC,244.7,9255.92219
13824,5120,32,3,50,Flash-LLM,1706.0,1327.62260
13824,5120,32,3,60,SpInfer,2690.0,673.58339
13824,5120,32,3,60,cuBLAS_TC,246.8,7341.73147
13824,5120,32,3,60,Flash-LLM,1693.7,1069.81126
13824,5120,32,3,70,SpInfer,2702.3,502.88809
13824,5120,32,3,70,cuBLAS_TC,244.7,5553.55331
13824,5120,32,3,70,Flash-LLM,1702.9,798.02366
8192,8192,8,7,40,SpInfer,2702.3,238.40621
8192,8192,8,7,40,cuBLAS_TC,327408.7,1.96771
8192,8192,8,7,40,Flash-LLM,1705.0,377.85636
8192,8192,8,7,50,SpInfer,2731.0,196.58400
8192,8192,8,7,50,cuBLAS_TC,327002.1,1.64180
8192,8192,8,7,50,Flash-LLM,1689.6,317.75030
8192,8192,8,7,60,SpInfer,2708.5,158.57365
8192,8192,8,7,60,cuBLAS_TC,326677.5,1.31474
8192,8192,8,7,60,Flash-LLM,1687.6,254.50150
8192,8192,8,7,70,SpInfer,2711.6,118.79427
8192,8192,8,7,70,cuBLAS_TC,326310.9,0.98716
8192,8192,8,7,70,Flash-LLM,1724.4,186.80268
8192,8192,16,7,40,SpInfer,2658.3,484.70458
8192,8192,16,7,40,cuBLAS_TC,618086.4,2.08464
8192,8192,16,7,40,Flash-LLM,1691.6,761.69909
8192,8192,16,7,50,SpInfer,2675.7,401.29380
8192,8192,16,7,50,cuBLAS_TC,617755.6,1.73813
8192,8192,16,7,50,Flash-LLM,1702.9,630.53722
8192,8192,16,7,60,SpInfer,2700.3,318.11038
8192,8192,16,7,60,cuBLAS_TC,616932.4,1.39236
8192,8192,16,7,60,Flash-LLM,1705.0,503.80848
8192,8192,16,7,70,SpInfer,2700.3,238.58279
8192,8192,16,7,70,cuBLAS_TC,614083.5,1.04912
8192,8192,16,7,70,Flash-LLM,1715.2,375.60931
8192,8192,32,7,40,SpInfer,2669.6,965.30581
8192,8192,32,7,40,cuBLAS_TC,243.7,10574.39630
8192,8192,32,7,40,Flash-LLM,1712.1,1505.15763
8192,8192,32,7,50,SpInfer,2701.3,794.98155
8192,8192,32,7,50,cuBLAS_TC,244.7,8775.98548
8192,8192,32,7,50,Flash-LLM,1714.2,1252.76143
8192,8192,32,7,60,SpInfer,2717.7,632.14737
8192,8192,32,7,60,cuBLAS_TC,248.8,6905.09212
8192,8192,32,7,60,Flash-LLM,1726.5,995.06917
8192,8192,32,7,70,SpInfer,2675.7,481.55256
8192,8192,32,7,70,cuBLAS_TC,245.8,5242.02681
8192,8192,32,7,70,Flash-LLM,1679.4,767.23246
18944,3584,8,7,40,SpInfer,2718.7,239.74504
18944,3584,8,7,40,cuBLAS_TC,335207.4,1.94445
18944,3584,8,7,40,Flash-LLM,1694.7,384.60780
18944,3584,8,7,50,SpInfer,2692.1,201.76159
18944,3584,8,7,50,cuBLAS_TC,336040.9,1.61636
18944,3584,8,7,50,Flash-LLM,1714.2,316.86056
18944,3584,8,7,60,SpInfer,2721.8,159.64799
18944,3584,8,7,60,cuBLAS_TC,335444.0,1.29539
18944,3584,8,7,60,Flash-LLM,1707.0,254.55764
18944,3584,8,7,70,SpInfer,2694.1,120.96708
18944,3584,8,7,70,cuBLAS_TC,335586.3,0.97113
18944,3584,8,7,70,Flash-LLM,1685.5,193.35356
18944,3584,16,7,40,SpInfer,2709.5,481.11817
18944,3584,16,7,40,cuBLAS_TC,649565.2,2.00687
18944,3584,16,7,40,Flash-LLM,1708.0,763.22581
18944,3584,16,7,50,SpInfer,2736.1,397.03400
18944,3584,16,7,50,cuBLAS_TC,647629.8,1.67739
18944,3584,16,7,50,Flash-LLM,1694.7,641.01300
18944,3584,16,7,60,SpInfer,2730.0,318.33692
18944,3584,16,7,60,cuBLAS_TC,646414.2,1.34443
18944,3584,16,7,60,Flash-LLM,1687.6,514.96788
18944,3584,16,7,70,SpInfer,2700.3,241.37868
18944,3584,16,7,70,cuBLAS_TC,645262.3,1.01012
18944,3584,16,7,70,Flash-LLM,1681.4,387.65008
18944,3584,32,7,40,SpInfer,2681.9,972.13892
18944,3584,32,7,40,cuBLAS_TC,246.8,10563.93584
18944,3584,32,7,40,Flash-LLM,1710.1,1524.57714
18944,3584,32,7,50,SpInfer,2727.9,796.45496
18944,3584,32,7,50,cuBLAS_TC,249.9,8694.07552
18944,3584,32,7,50,Flash-LLM,1687.6,1287.41969
18944,3584,32,7,60,SpInfer,2690.0,646.14111
18944,3584,32,7,60,cuBLAS_TC,247.8,7014.20330
18944,3584,32,7,60,Flash-LLM,1684.5,1031.83115
18944,3584,32,7,70,SpInfer,2689.0,484.78605
18944,3584,32,7,70,cuBLAS_TC,248.8,5239.50837
18944,3584,32,7,70,Flash-LLM,1706.0,764.12056
14336,4096,8,7,40,SpInfer,2675.7,210.67925
14336,4096,8,7,40,cuBLAS_TC,288768.0,1.95214
14336,4096,8,7,40,Flash-LLM,1687.6,334.03322
14336,4096,8,7,50,SpInfer,2660.4,176.57572
14336,4096,8,7,50,cuBLAS_TC,289080.3,1.62502
14336,4096,8,7,50,Flash-LLM,1678.3,279.90350
14336,4096,8,7,60,SpInfer,2679.8,140.23794
14336,4096,8,7,60,cuBLAS_TC,288327.7,1.30341
14336,4096,8,7,60,Flash-LLM,1694.7,221.75585
14336,4096,8,7,70,SpInfer,2669.6,105.58032
14336,4096,8,7,70,cuBLAS_TC,289975.3,0.97200
14336,4096,8,7,70,Flash-LLM,1709.1,164.91559
14336,4096,16,7,40,SpInfer,2664.4,423.14552
14336,4096,16,7,40,cuBLAS_TC,545215.5,2.06786
14336,4096,16,7,40,Flash-LLM,1713.2,658.08365
14336,4096,16,7,50,SpInfer,2678.8,350.72573
14336,4096,16,7,50,cuBLAS_TC,544119.8,1.72669
14336,4096,16,7,50,Flash-LLM,1682.4,558.44276
14336,4096,16,7,60,SpInfer,2648.1,283.83342
14336,4096,16,7,60,cuBLAS_TC,541571.0,1.38785
14336,4096,16,7,60,Flash-LLM,1678.3,447.84560
14336,4096,16,7,70,SpInfer,2661.4,211.81125
14336,4096,16,7,70,cuBLAS_TC,542058.4,1.03995
14336,4096,16,7,70,Flash-LLM,1710.1,329.63830
14336,4096,32,7,40,SpInfer,2664.4,846.29103
14336,4096,32,7,40,cuBLAS_TC,244.7,9214.78476
14336,4096,32,7,40,Flash-LLM,1692.7,1332.10718
14336,4096,32,7,50,SpInfer,2663.4,705.50732
14336,4096,32,7,50,cuBLAS_TC,243.7,7710.49730
14336,4096,32,7,50,Flash-LLM,1690.6,1111.46823
14336,4096,32,7,60,SpInfer,2719.7,552.72219
14336,4096,32,7,60,cuBLAS_TC,244.7,6143.18984
14336,4096,32,7,60,Flash-LLM,1682.4,893.50841
14336,4096,32,7,70,SpInfer,2704.4,416.88689
14336,4096,32,7,70,cuBLAS_TC,245.8,4586.77345
14336,4096,32,7,70,Flash-LLM,1686.5,668.50217
4096,14336,8,7,40,SpInfer,2722.8,207.03484
4096,14336,8,7,40,cuBLAS_TC,296375.3,1.90203
4096,14336,8,7,40,Flash-LLM,1721.3,327.49344
4096,14336,8,7,50,SpInfer,2731.0,172.01100
4096,14336,8,7,50,cuBLAS_TC,296343.6,1.58519
4096,14336,8,7,50,Flash-LLM,1676.3,280.23746
4096,14336,8,7,60,SpInfer,2744.3,136.94189
4096,14336,8,7,60,cuBLAS_TC,296166.4,1.26891
4096,14336,8,7,60,Flash-LLM,1732.6,216.90502
4096,14336,8,7,70,SpInfer,2752.5,102.40045
4096,14336,8,7,70,cuBLAS_TC,295602.2,0.95350
4096,14336,8,7,70,Flash-LLM,1713.2,164.52091
4096,14336,16,7,40,SpInfer,2690.0,419.11856
4096,14336,16,7,40,cuBLAS_TC,575571.9,1.95880
4096,14336,16,7,40,Flash-LLM,1711.1,658.89131
4096,14336,16,7,50,SpInfer,2709.5,346.75183
4096,14336,16,7,50,cuBLAS_TC,575228.9,1.63330
4096,14336,16,7,50,Flash-LLM,1709.1,549.71862
4096,14336,16,7,60,SpInfer,2736.1,274.70461
4096,14336,16,7,60,cuBLAS_TC,575083.5,1.30697
4096,14336,16,7,60,Flash-LLM,1696.8,442.96280
4096,14336,16,7,70,SpInfer,2714.6,207.66023
4096,14336,16,7,70,cuBLAS_TC,575278.1,0.97990
4096,14336,16,7,70,Flash-LLM,1706.0,330.43051
4096,14336,32,7,40,SpInfer,2713.6,830.94702
4096,14336,32,7,40,cuBLAS_TC,244.7,9214.78476
4096,14336,32,7,40,Flash-LLM,1706.0,1321.72206
4096,14336,32,7,50,SpInfer,2697.2,696.66624
4096,14336,32,7,50,cuBLAS_TC,243.7,7710.49730
4096,14336,32,7,50,Flash-LLM,1688.6,1112.78467
4096,14336,32,7,60,SpInfer,2695.2,557.74657
4096,14336,32,7,60,cuBLAS_TC,249.9,6015.36036
4096,14336,32,7,60,Flash-LLM,1700.9,883.79008
4096,14336,32,7,70,SpInfer,2698.2,417.84483
4096,14336,32,7,70,cuBLAS_TC,243.7,4626.29838
4096,14336,32,7,70,Flash-LLM,1716.2,656.93329
8192,28672,8,7,40,SpInfer,2758.7,817.36246
8192,28672,8,7,40,cuBLAS_TC,1167185.9,1.93188
8192,28672,8,7,40,Flash-LLM,1706.5,1321.33480
8192,28672,8,7,50,SpInfer,2794.5,672.40944
8192,28672,8,7,50,cuBLAS_TC,1166996.5,1.61016
8192,28672,8,7,50,Flash-LLM,1705.1,1102.01642
8192,28672,8,7,60,SpInfer,2791.4,538.52495
8192,28672,8,7,60,cuBLAS_TC,1167179.9,1.28792
8192,28672,8,7,60,Flash-LLM,1703.1,882.64844
8192,28672,8,7,70,SpInfer,2767.9,407.32285
8192,28672,8,7,70,cuBLAS_TC,1167368.1,0.96579
8192,28672,8,7,70,Flash-LLM,1708.5,659.89401
8192,28672,16,7,40,SpInfer,2717.7,1659.38686
8192,28672,16,7,40,cuBLAS_TC,2308395.0,1.95362
8192,28672,16,7,40,Flash-LLM,1694.1,2662.01267
8192,28672,16,7,50,SpInfer,2733.1,1375.03069
8192,28672,16,7,50,cuBLAS_TC,2308825.2,1.62771
8192,28672,16,7,50,Flash-LLM,1692.0,2221.09715
8192,28672,16,7,60,SpInfer,2733.1,1100.02455
8192,28672,16,7,60,cuBLAS_TC,2308576.0,1.30231
8192,28672,16,7,60,Flash-LLM,1698.8,1769.76519
8192,28672,16,7,70,SpInfer,2708.5,832.51166
8192,28672,16,7,70,cuBLAS_TC,2308705.2,0.97668
8192,28672,16,7,70,Flash-LLM,1691.1,1333.36753
8192,28672,32,7,40,SpInfer,2704.4,3335.09515
8192,28672,32,7,40,cuBLAS_TC,245.8,36694.18764
8192,28672,32,7,40,Flash-LLM,1707.3,5282.86260
8192,28672,32,7,50,SpInfer,2725.9,2757.32520
8192,28672,32,7,50,cuBLAS_TC,244.7,30715.94919
8192,28672,32,7,50,Flash-LLM,1696.5,4430.41130
8192,28672,32,7,60,SpInfer,2713.6,2215.85872
8192,28672,32,7,60,cuBLAS_TC,244.7,24572.75936
8192,28672,32,7,60,Flash-LLM,1694.0,3549.55975
8192,28672,32,7,70,SpInfer,2701.3,1669.46124
8192,28672,32,7,70,cuBLAS_TC,254.0,17754.78607
8192,28672,32,7,70,Flash-LLM,1692.6,2664.37177
11008,4096,8,7,40,SpInfer,2684.9,161.21724
11008,4096,8,7,40,cuBLAS_TC,226905.1,1.90764
11008,4096,8,7,40,Flash-LLM,1694.7,255.41522
11008,4096,8,7,50,SpInfer,2753.5,131.00060
11008,4096,8,7,50,cuBLAS_TC,230962.2,1.56177
11008,4096,8,7,50,Flash-LLM,1693.7,212.97169
11008,4096,8,7,60,SpInfer,2701.3,106.82565
11008,4096,8,7,60,cuBLAS_TC,227061.8,1.27088
11008,4096,8,7,60,Flash-LLM,1687.6,170.99319
11008,4096,8,7,70,SpInfer,2754.6,78.56897
11008,4096,8,7,70,cuBLAS_TC,226488.3,0.95557
11008,4096,8,7,70,Flash-LLM,1686.5,128.32854
11008,4096,16,7,40,SpInfer,2681.9,322.79516
11008,4096,16,7,40,cuBLAS_TC,424049.7,2.04152
11008,4096,16,7,40,Flash-LLM,1692.7,511.43401
11008,4096,16,7,50,SpInfer,2686.0,268.58536
11008,4096,16,7,50,cuBLAS_TC,421275.7,1.71247
11008,4096,16,7,50,Flash-LLM,1695.7,425.44099
11008,4096,16,7,60,SpInfer,2705.4,213.32750
11008,4096,16,7,60,cuBLAS_TC,421911.6,1.36791
11008,4096,16,7,60,Flash-LLM,1710.1,337.48683
11008,4096,16,7,70,SpInfer,2725.9,158.79239
11008,4096,16,7,70,cuBLAS_TC,420751.4,1.02876
11008,4096,16,7,70,Flash-LLM,1684.5,256.96181
11008,4096,32,7,40,SpInfer,2671.6,648.07931
11008,4096,32,7,40,cuBLAS_TC,242.7,7133.94599
11008,4096,32,7,40,Flash-LLM,1698.8,1019.19513
11008,4096,32,7,50,SpInfer,2766.8,521.48351
11008,4096,32,7,50,cuBLAS_TC,248.8,5799.19846
11008,4096,32,7,50,Flash-LLM,1709.1,844.21074
11008,4096,32,7,60,SpInfer,2637.8,437.58907
11008,4096,32,7,60,cuBLAS_TC,245.8,4695.98235
11008,4096,32,7,60,Flash-LLM,1677.3,688.17293
11008,4096,32,7,70,SpInfer,2997.2,288.83770
11008,4096,32,7,70,cuBLAS_TC,224.3,3859.58246
11008,4096,32,7,70,Flash-LLM,1688.6,512.67579
32000,4096,8,3,40,SpInfer,2663.4,472.43794
32000,4096,8,3,40,cuBLAS_TC,605466.6,2.07822
32000,4096,8,3,40,Flash-LLM,1696.8,741.56719
32000,4096,8,3,50,SpInfer,2729.0,384.23452
32000,4096,8,3,50,cuBLAS_TC,606308.3,1.72944
32000,4096,8,3,50,Flash-LLM,1705.0,615.00059
32000,4096,8,3,60,SpInfer,2694.1,311.36959
32000,4096,8,3,60,cuBLAS_TC,601337.9,1.39499
32000,4096,8,3,60,Flash-LLM,1693.7,495.28299
32000,4096,8,3,70,SpInfer,2717.7,231.49928
32000,4096,8,3,70,cuBLAS_TC,601903.1,1.04526
32000,4096,8,3,70,Flash-LLM,1732.6,363.12224
32000,4096,16,3,40,SpInfer,2701.3,931.61900
32000,4096,16,3,40,cuBLAS_TC,1187920.9,2.11848
32000,4096,16,3,40,Flash-LLM,1699.8,1480.51677
32000,4096,16,3,50,SpInfer,2741.2,765.04888
32000,4096,16,3,50,cuBLAS_TC,1187203.1,1.76646
32000,4096,16,3,50,Flash-LLM,1711.1,1225.61627
32000,4096,16,3,60,SpInfer,2713.6,618.26415
32000,4096,16,3,60,cuBLAS_TC,1187660.9,1.41263
32000,4096,16,3,60,Flash-LLM,1696.8,988.75625
32000,4096,16,3,70,SpInfer,2719.7,462.65809
32000,4096,16,3,70,cuBLAS_TC,1178546.2,1.06766
32000,4096,16,3,70,Flash-LLM,1715.2,733.61194
32000,4096,32,3,40,SpInfer,2710.5,1856.91378
32000,4096,32,3,40,cuBLAS_TC,245.8,20476.66721
32000,4096,32,3,40,Flash-LLM,1687.6,2982.43944
32000,4096,32,3,50,SpInfer,2692.1,1558.00453
32000,4096,32,3,50,cuBLAS_TC,245.8,17063.88934
32000,4096,32,3,50,Flash-LLM,1719.3,2439.54167
32000,4096,32,3,60,SpInfer,2672.6,1255.49772
32000,4096,32,3,60,cuBLAS_TC,248.8,13486.50804
32000,4096,32,3,60,Flash-LLM,1711.1,1960.98603
32000,4096,32,3,70,SpInfer,2684.9,937.30955
32000,4096,32,3,70,cuBLAS_TC,245.8,10238.33360
32000,4096,32,3,70,Flash-LLM,1698.8,1481.38827
20480,3584,8,6,40,SpInfer,2674.7,263.44752
20480,3584,8,6,40,cuBLAS_TC,360103.9,1.95678
20480,3584,8,6,40,Flash-LLM,1694.7,415.79222
20480,3584,8,6,50,SpInfer,2642.9,222.18115
20480,3584,8,6,50,cuBLAS_TC,358707.2,1.63700
20480,3584,8,6,50,Flash-LLM,1689.6,347.53939
20480,3584,8,6,60,SpInfer,2663.4,176.37683
20480,3584,8,6,60,cuBLAS_TC,357878.8,1.31263
20480,3584,8,6,60,Flash-LLM,1688.6,278.19617
20480,3584,8,6,70,SpInfer,2657.3,132.58629
20480,3584,8,6,70,cuBLAS_TC,358303.8,0.98330
20480,3584,8,6,70,Flash-LLM,1690.6,208.40029
20480,3584,16,6,40,SpInfer,2656.3,530.54480
20480,3584,16,6,40,cuBLAS_TC,701234.2,2.00972
20480,3584,16,6,40,Flash-LLM,1684.5,836.61985
20480,3584,16,6,50,SpInfer,2667.5,440.26434
20480,3584,16,6,50,cuBLAS_TC,701007.9,1.67531
20480,3584,16,6,50,Flash-LLM,1696.8,692.12937
20480,3584,16,6,60,SpInfer,2672.6,351.53936
20480,3584,16,6,60,cuBLAS_TC,697481.2,1.34702
20480,3584,16,6,60,Flash-LLM,1676.3,560.47491
20480,3584,16,6,70,SpInfer,2658.3,265.07282
20480,3584,16,6,70,cuBLAS_TC,697741.3,1.00989
20480,3584,16,6,70,Flash-LLM,1679.4,419.58025
20480,3584,32,6,40,SpInfer,2689.0,1048.18605
20480,3584,32,6,40,cuBLAS_TC,243.7,11565.74595
20480,3584,32,6,40,Flash-LLM,1675.3,1682.42839
20480,3584,32,6,50,SpInfer,2660.4,882.87860
20480,3584,32,6,50,cuBLAS_TC,244.7,9598.73412
20480,3584,32,6,50,Flash-LLM,1687.6,1391.80507
20480,3584,32,6,60,SpInfer,2682.9,700.37951
20480,3584,32,6,60,cuBLAS_TC,243.7,7710.49730
20480,3584,32,6,60,Flash-LLM,1712.1,1097.51077
20480,3584,32,6,70,SpInfer,2667.5,528.31720
20480,3584,32,6,70,cuBLAS_TC,245.8,5733.46682
20480,3584,32,6,70,Flash-LLM,1699.8,829.08939
3584,18944,8,7,40,SpInfer,2737.2,238.12467
3584,18944,8,7,40,cuBLAS_TC,368555.0,1.76851
3584,18944,8,7,40,Flash-LLM,1700.9,383.20586
3584,18944,8,7,50,SpInfer,2695.2,201.52952
3584,18944,8,7,50,cuBLAS_TC,368652.3,1.47337
3584,18944,8,7,50,Flash-LLM,1697.8,319.92129
3584,18944,8,7,60,SpInfer,3150.8,137.91097
3584,18944,8,7,60,cuBLAS_TC,368832.5,1.17812
3584,18944,8,7,60,Flash-LLM,1697.8,255.93703
3584,18944,8,7,70,SpInfer,2729.0,119.42009
3584,18944,8,7,70,cuBLAS_TC,368664.6,0.88399
3584,18944,8,7,70,Flash-LLM,1685.5,193.35356
3584,18944,16,7,40,SpInfer,2677.8,486.81368
3584,18944,16,7,40,cuBLAS_TC,724415.5,1.79951
3584,18944,16,7,40,Flash-LLM,1699.8,766.90769
3584,18944,16,7,50,SpInfer,2715.6,400.03120
3584,18944,16,7,50,cuBLAS_TC,724316.2,1.49979
3584,18944,16,7,50,Flash-LLM,1702.9,637.92632
3584,18944,16,7,60,SpInfer,2686.0,323.55167
3584,18944,16,7,60,cuBLAS_TC,724236.2,1.19997
3584,18944,16,7,60,Flash-LLM,1703.9,510.04155
3584,18944,16,7,70,SpInfer,2664.4,244.63100
3584,18944,16,7,70,cuBLAS_TC,724584.4,0.89954
3584,18944,16,7,70,Flash-LLM,1689.6,385.76873
3584,18944,32,7,40,SpInfer,2690.0,969.21166
3584,18944,32,7,40,cuBLAS_TC,244.7,10654.59488
3584,18944,32,7,40,Flash-LLM,1688.6,1543.98873
3584,18944,32,7,50,SpInfer,2655.2,818.26208
3584,18944,32,7,50,cuBLAS_TC,245.8,8839.09468
3584,18944,32,7,50,Flash-LLM,1712.1,1268.99683
3584,18944,32,7,60,SpInfer,2668.5,651.34704
3584,18944,32,7,60,cuBLAS_TC,243.7,7132.21000
3584,18944,32,7,60,Flash-LLM,1709.1,1016.97945
3584,18944,32,7,70,SpInfer,2718.7,479.49008
3584,18944,32,7,70,cuBLAS_TC,244.7,5327.29744
3584,18944,32,7,70,Flash-LLM,1703.9,765.06232
21504,7168,8,1,40,SpInfer,2742.3,539.60196
21504,7168,8,1,40,cuBLAS_TC,746977.2,1.98098
21504,7168,8,1,40,Flash-LLM,1696.0,872.49437
21504,7168,8,1,50,SpInfer,2744.3,449.34059
21504,7168,8,1,50,cuBLAS_TC,747053.0,1.65065
21504,7168,8,1,50,Flash-LLM,1723.3,715.56048
21504,7168,8,1,60,SpInfer,2753.5,358.27140
21504,7168,8,1,60,cuBLAS_TC,747068.4,1.32050
21504,7168,8,1,60,Flash-LLM,1707.2,577.84694
21504,7168,8,1,70,SpInfer,2752.5,268.80117
21504,7168,8,1,70,cuBLAS_TC,747234.3,0.99015
21504,7168,8,1,70,Flash-LLM,1712.7,431.99348
21504,7168,16,1,40,SpInfer,2667.5,1109.46613
21504,7168,16,1,40,cuBLAS_TC,1470256.1,2.01292
21504,7168,16,1,40,Flash-LLM,1683.4,1758.04972
21504,7168,16,1,50,SpInfer,2673.7,922.41117
21504,7168,16,1,50,cuBLAS_TC,1463500.9,1.68517
21504,7168,16,1,50,Flash-LLM,1701.2,1449.71241
21504,7168,16,1,60,SpInfer,2732.0,722.18177
21504,7168,16,1,60,cuBLAS_TC,1462909.9,1.34868
21504,7168,16,1,60,Flash-LLM,1700.7,1160.11090
21504,7168,16,1,70,SpInfer,2707.5,546.53756
21504,7168,16,1,70,cuBLAS_TC,1462571.0,1.01175
21504,7168,16,1,70,Flash-LLM,1696.8,872.08301
21504,7168,32,1,40,SpInfer,2762.8,2142.39243
21504,7168,32,1,40,cuBLAS_TC,246.8,23982.98948
21504,7168,32,1,40,Flash-LLM,1685.6,3511.51033
21504,7168,32,1,50,SpInfer,2707.5,1821.79188
21504,7168,32,1,50,cuBLAS_TC,251.9,19581.18898
21504,7168,32,1,50,Flash-LLM,1695.3,2909.51543
21504,7168,32,1,60,SpInfer,2712.6,1454.69336
21504,7168,32,1,60,cuBLAS_TC,249.9,15790.32094
21504,7168,32,1,60,Flash-LLM,1692.4,2331.60081
21504,7168,32,1,70,SpInfer,2711.6,1091.42237
21504,7168,32,1,70,cuBLAS_TC,244.7,12094.40500
21504,7168,32,1,70,Flash-LLM,1681.1,1760.45500
7168,7168,8,3,40,SpInfer,2752.5,179.20078
7168,7168,8,3,40,cuBLAS_TC,286993.4,1.71868
7168,7168,8,3,40,Flash-LLM,1709.1,288.60228
7168,7168,8,3,50,SpInfer,2742.3,149.88943
7168,7168,8,3,50,cuBLAS_TC,286837.8,1.43301
7168,7168,8,3,50,Flash-LLM,1699.8,241.81774
7168,7168,8,3,60,SpInfer,2739.2,120.04725
7168,7168,8,3,60,cuBLAS_TC,286958.6,1.14593
7168,7168,8,3,60,Flash-LLM,1717.2,191.49396
7168,7168,8,3,70,SpInfer,2715.6,90.81789
7168,7168,8,3,70,cuBLAS_TC,287254.5,0.85856
7168,7168,8,3,70,Flash-LLM,1700.9,144.99681
7168,7168,16,3,40,SpInfer,3087.4,319.52462
7168,7168,16,3,40,cuBLAS_TC,538359.8,1.83242
7168,7168,16,3,40,Flash-LLM,1685.5,585.28644
7168,7168,16,3,50,SpInfer,2713.6,302.94943
7168,7168,16,3,50,cuBLAS_TC,538401.8,1.52690
7168,7168,16,3,50,Flash-LLM,1706.0,481.87783
7168,7168,16,3,60,SpInfer,2690.0,244.48582
7168,7168,16,3,60,cuBLAS_TC,538500.1,1.22129
7168,7168,16,3,60,Flash-LLM,1701.9,386.43097
7168,7168,16,3,70,SpInfer,2691.1,183.28942
7168,7168,16,3,70,cuBLAS_TC,538687.5,0.91565
7168,7168,16,3,70,Flash-LLM,1681.4,293.35682
7168,7168,32,3,40,SpInfer,2702.3,730.11901
7168,7168,32,3,40,cuBLAS_TC,244.7,8062.93666
7168,7168,32,3,40,Flash-LLM,1716.2,1149.63326
7168,7168,32,3,50,SpInfer,2663.4,617.31890
7168,7168,32,3,50,cuBLAS_TC,244.7,6719.11389
7168,7168,32,3,50,Flash-LLM,1702.9,965.51011
7168,7168,32,3,60,SpInfer,2636.8,498.83713
7168,7168,32,3,60,cuBLAS_TC,244.7,5375.29111
7168,7168,32,3,60,Flash-LLM,1711.1,768.70652
7168,7168,32,3,70,SpInfer,2665.5,370.09953
7168,7168,32,3,70,cuBLAS_TC,243.7,4048.01108
7168,7168,32,3,70,Flash-LLM,1693.7,582.45280
28672,7168,8,4,40,SpInfer,2687.0,734.27637
28672,7168,8,4,40,cuBLAS_TC,993025.0,1.98686
28672,7168,8,4,40,Flash-LLM,1705.1,1157.11724
28672,7168,8,4,50,SpInfer,2798.6,587.49631
28672,7168,8,4,50,cuBLAS_TC,990147.6,1.66053
28672,7168,8,4,50,Flash-LLM,1695.2,969.89569
28672,7168,8,4,60,SpInfer,2731.0,481.63081
28672,7168,8,4,60,cuBLAS_TC,986920.9,1.33277
28672,7168,8,4,60,Flash-LLM,1705.0,771.45674
28672,7168,8,4,70,SpInfer,2735.1,360.68162
28672,7168,8,4,70,cuBLAS_TC,987725.9,0.99876
28672,7168,8,4,70,Flash-LLM,1691.5,583.21035
28672,7168,16,4,40,SpInfer,2777.1,1420.90713
28672,7168,16,4,40,cuBLAS_TC,1944431.6,2.02939
28672,7168,16,4,40,Flash-LLM,1718.1,2296.72382
28672,7168,16,4,50,SpInfer,2726.9,1205.88739
28672,7168,16,4,50,cuBLAS_TC,1944334.4,1.69124
28672,7168,16,4,50,Flash-LLM,1700.5,1933.74557
28672,7168,16,4,60,SpInfer,2712.6,969.79557
28672,7168,16,4,60,cuBLAS_TC,1942632.4,1.35418
28672,7168,16,4,60,Flash-LLM,1708.3,1539.93296
28672,7168,16,4,70,SpInfer,2704.4,729.55206
28672,7168,16,4,70,cuBLAS_TC,1935551.5,1.01935
28672,7168,16,4,70,Flash-LLM,1691.5,1166.42069
28672,7168,32,4,40,SpInfer,2694.1,2929.36506
28672,7168,32,4,40,cuBLAS_TC,252.9,31206.01980
28672,7168,32,4,40,Flash-LLM,1694.6,4657.14765
28672,7168,32,4,50,SpInfer,2705.4,2430.94133
28672,7168,32,4,50,cuBLAS_TC,244.7,26876.45555
28672,7168,32,4,50,Flash-LLM,1703.0,3861.81367
28672,7168,32,4,60,SpInfer,2716.7,1936.66394
28672,7168,32,4,60,cuBLAS_TC,244.7,21501.16444
28672,7168,32,4,60,Flash-LLM,1725.8,3048.63538
28672,7168,32,4,70,SpInfer,2707.5,1457.43350
28672,7168,32,4,70,cuBLAS_TC,244.7,16125.87333
28672,7168,32,4,70,Flash-LLM,1688.4,2337.12462
7168,28672,8,3,40,SpInfer,2812.9,701.41157
7168,28672,8,3,40,cuBLAS_TC,1142189.1,1.72739
7168,28672,8,3,40,Flash-LLM,1752.6,1125.75636
7168,28672,8,3,50,SpInfer,2758.7,595.99346
7168,28672,8,3,50,cuBLAS_TC,1141895.1,1.43986
7168,28672,8,3,50,Flash-LLM,1701.0,966.58858
7168,28672,8,3,60,SpInfer,2793.5,470.85510
7168,28672,8,3,60,cuBLAS_TC,1141609.5,1.15217
7168,28672,8,3,60,Flash-LLM,1692.5,777.15435
7168,28672,8,3,70,SpInfer,2776.1,355.35474
7168,28672,8,3,70,cuBLAS_TC,1141493.8,0.86422
7168,28672,8,3,70,Flash-LLM,1683.6,585.94696
7168,28672,16,3,40,SpInfer,2789.4,1414.64157
7168,28672,16,3,40,cuBLAS_TC,2242990.0,1.75926
7168,28672,16,3,40,Flash-LLM,1691.7,2332.56559
7168,28672,16,3,50,SpInfer,2777.1,1184.08928
7168,28672,16,3,50,cuBLAS_TC,2243595.0,1.46565
7168,28672,16,3,50,Flash-LLM,1695.5,1939.44815
7168,28672,16,3,60,SpInfer,2765.8,951.14161
7168,28672,16,3,60,cuBLAS_TC,2244789.2,1.17190
7168,28672,16,3,60,Flash-LLM,1748.1,1504.87242
7168,28672,16,3,70,SpInfer,2787.3,707.85369
7168,28672,16,3,70,cuBLAS_TC,2242248.8,0.87992
7168,28672,16,3,70,Flash-LLM,1702.0,1159.22480
7168,28672,32,3,40,SpInfer,2732.0,2888.72709
7168,28672,32,3,40,cuBLAS_TC,244.7,32251.74665
7168,28672,32,3,40,Flash-LLM,1696.0,4653.30331
7168,28672,32,3,50,SpInfer,2725.9,2412.65955
7168,28672,32,3,50,cuBLAS_TC,247.8,26540.22870
7168,28672,32,3,50,Flash-LLM,1738.8,3782.30312
7168,28672,32,3,60,SpInfer,2722.8,1932.32516
7168,28672,32,3,60,cuBLAS_TC,243.7,21589.39244
7168,28672,32,3,60,Flash-LLM,1700.2,3094.53884
7168,28672,32,3,70,SpInfer,2710.5,1455.82040
7168,28672,32,3,70,cuBLAS_TC,243.7,16192.04433
7168,28672,32,3,70,Flash-LLM,1697.9,2324.04806
27648,9216,8,7,40,SpInfer,2714.6,901.09707
27648,9216,8,7,40,cuBLAS_TC,1247694.9,1.96051
27648,9216,8,7,40,Flash-LLM,1707.5,1432.57282
27648,9216,8,7,50,SpInfer,2710.5,752.05008
27648,9216,8,7,50,cuBLAS_TC,1247303.8,1.63427
27648,9216,8,7,50,Flash-LLM,1683.5,1210.82967
27648,9216,8,7,60,SpInfer,2715.6,600.51016
27648,9216,8,7,60,cuBLAS_TC,1247870.0,1.30682
27648,9216,8,7,60,Flash-LLM,1736.6,939.04491
27648,9216,8,7,70,SpInfer,2721.8,449.35669
27648,9216,8,7,70,cuBLAS_TC,1247437.9,0.98046
27648,9216,8,7,70,Flash-LLM,1758.8,695.39405
27648,9216,16,7,40,SpInfer,2729.0,1792.68457
27648,9216,16,7,40,cuBLAS_TC,2419224.5,2.02223
27648,9216,16,7,40,Flash-LLM,1708.2,2863.97154
27648,9216,16,7,50,SpInfer,2720.8,1498.40616
27648,9216,16,7,50,cuBLAS_TC,2414165.0,1.68873
27648,9216,16,7,50,Flash-LLM,1717.1,2374.27260
27648,9216,16,7,60,SpInfer,2697.2,1209.21355
27648,9216,16,7,60,cuBLAS_TC,2408111.0,1.35438
27648,9216,16,7,60,Flash-LLM,1686.9,1933.42272
27648,9216,16,7,70,SpInfer,2716.7,900.40052
27648,9216,16,7,70,cuBLAS_TC,2403970.0,1.01753
27648,9216,16,7,70,Flash-LLM,1681.9,1454.37784
27648,9216,32,7,40,SpInfer,2753.5,3553.46736
27648,9216,32,7,40,cuBLAS_TC,244.7,39985.58386
27648,9216,32,7,40,Flash-LLM,1705.2,5738.02039
27648,9216,32,7,50,SpInfer,2715.6,3002.55081
27648,9216,32,7,50,cuBLAS_TC,244.7,33321.31989
27648,9216,32,7,50,Flash-LLM,1687.2,4832.69735
27648,9216,32,7,60,SpInfer,2788.4,2339.32778
27648,9216,32,7,60,cuBLAS_TC,244.7,26657.05591
27648,9216,32,7,60,Flash-LLM,1702.7,3830.96352
27648,9216,32,7,70,SpInfer,2714.6,1802.19413
27648,9216,32,7,70,cuBLAS_TC,244.7,19992.79193
27648,9216,32,7,70,Flash-LLM,1696.5,2883.72307
9216,9216,8,5,40,SpInfer,2765.8,294.80537
9216,9216,8,5,40,cuBLAS_TC,477255.7,1.70846
9216,9216,8,5,40,Flash-LLM,1708.0,477.38448
9216,9216,8,5,50,SpInfer,2722.8,249.55092
9216,9216,8,5,50,cuBLAS_TC,476659.7,1.42550
9216,9216,8,5,50,Flash-LLM,1693.7,401.17922
9216,9216,8,5,60,SpInfer,2756.6,197.19285
9216,9216,8,5,60,cuBLAS_TC,476500.0,1.14078
9216,9216,8,5,60,Flash-LLM,1700.9,319.58481
9216,9216,8,5,70,SpInfer,2744.3,148.55750
9216,9216,8,5,70,cuBLAS_TC,477366.3,0.85403
9216,9216,8,5,70,Flash-LLM,1697.8,240.12625
9216,9216,16,5,40,SpInfer,2691.1,605.97726
9216,9216,16,5,40,cuBLAS_TC,866863.1,1.88120
9216,9216,16,5,40,Flash-LLM,1686.5,966.94064
9216,9216,16,5,50,SpInfer,2687.0,505.75158
9216,9216,16,5,50,cuBLAS_TC,866386.9,1.56853
9216,9216,16,5,50,Flash-LLM,1722.4,788.98891
9216,9216,16,5,60,SpInfer,2657.3,409.12339
9216,9216,16,5,60,cuBLAS_TC,866076.6,1.25527
9216,9216,16,5,60,Flash-LLM,1709.1,636.10298
9216,9216,16,5,70,SpInfer,2670.6,305.31442
9216,9216,16,5,70,cuBLAS_TC,866243.6,0.94127
9216,9216,16,5,70,Flash-LLM,1695.7,480.84726
9216,9216,32,5,40,SpInfer,2684.9,1214.75317
9216,9216,32,5,40,cuBLAS_TC,248.8,13108.88581
9216,9216,32,5,40,Flash-LLM,1683.5,1937.32747
9216,9216,32,5,50,SpInfer,2665.5,1019.66197
9216,9216,32,5,50,cuBLAS_TC,246.8,11012.59721
9216,9216,32,5,50,Flash-LLM,1700.9,1597.92404
9216,9216,32,5,60,SpInfer,2645.0,822.05187
9216,9216,32,5,60,cuBLAS_TC,245.8,8845.92023
9216,9216,32,5,60,Flash-LLM,1696.8,1281.42810
9216,9216,32,5,70,SpInfer,2665.5,611.79718
9216,9216,32,5,70,cuBLAS_TC,244.7,6664.26398
9216,9216,32,5,70,Flash-LLM,1677.3,972.24432
36864,9216,8,2,40,SpInfer,2682.9,1215.65872
36864,9216,8,2,40,cuBLAS_TC,1640222.8,1.98844
36864,9216,8,2,40,Flash-LLM,1676.2,1945.76470
36864,9216,8,2,50,SpInfer,2682.9,1013.04894
36864,9216,8,2,50,cuBLAS_TC,1635024.9,1.66230
36864,9216,8,2,50,Flash-LLM,1700.8,1598.01799
36864,9216,8,2,60,SpInfer,2689.0,808.60067
36864,9216,8,2,60,cuBLAS_TC,1633416.1,1.33115
36864,9216,8,2,60,Flash-LLM,1691.8,1285.21527
36864,9216,8,2,70,SpInfer,3158.0,516.38550
36864,9216,8,2,70,cuBLAS_TC,1631230.0,0.99970
36864,9216,8,2,70,Flash-LLM,1704.4,956.78561
36864,9216,16,2,40,SpInfer,2699.3,2416.54562
36864,9216,16,2,40,cuBLAS_TC,3215871.0,2.02837
36864,9216,16,2,40,Flash-LLM,1715.8,3801.71441
36864,9216,16,2,50,SpInfer,2733.1,1988.88368
36864,9216,16,2,50,cuBLAS_TC,3206643.8,1.69517
36864,9216,16,2,50,Flash-LLM,1694.3,3208.29722
36864,9216,16,2,60,SpInfer,2712.6,1603.13146
36864,9216,16,2,60,cuBLAS_TC,3205453.0,1.35664
36864,9216,16,2,60,Flash-LLM,1699.4,2558.93515
36864,9216,16,2,70,SpInfer,2692.1,1211.50432
36864,9216,16,2,70,cuBLAS_TC,3202514.0,1.01842
36864,9216,16,2,70,Flash-LLM,1707.4,1910.20897
36864,9216,32,2,40,SpInfer,2697.2,4836.85420
36864,9216,32,2,40,cuBLAS_TC,244.7,53314.11182
36864,9216,32,2,40,Flash-LLM,1703.6,7657.87929
36864,9216,32,2,50,SpInfer,2733.1,3977.76736
36864,9216,32,2,50,cuBLAS_TC,245.8,44229.60117
36864,9216,32,2,50,Flash-LLM,1694.7,6415.07994
36864,9216,32,2,60,SpInfer,2729.0,3186.99479
36864,9216,32,2,60,cuBLAS_TC,243.7,35688.58750
36864,9216,32,2,60,Flash-LLM,1713.6,5075.46030
36864,9216,32,2,70,SpInfer,2750.5,2371.56211
36864,9216,32,2,70,cuBLAS_TC,243.7,26766.44063
36864,9216,32,2,70,Flash-LLM,1723.0,3785.82796
9216,36864,8,5,40,SpInfer,2791.4,1168.40682
9216,36864,8,5,40,cuBLAS_TC,1990409.1,1.63860
9216,36864,8,5,40,Flash-LLM,1691.7,1927.93686
9216,36864,8,5,50,SpInfer,2790.4,974.02128
9216,36864,8,5,50,cuBLAS_TC,1991281.6,1.36490
9216,36864,8,5,50,Flash-LLM,1687.6,1610.51730
9216,36864,8,5,60,SpInfer,2746.4,791.70084
9216,36864,8,5,60,cuBLAS_TC,1991985.1,1.09154
9216,36864,8,5,60,Flash-LLM,1696.9,1281.35258
9216,36864,8,5,70,SpInfer,2831.4,575.95020
9216,36864,8,5,70,cuBLAS_TC,1993559.1,0.81801
9216,36864,8,5,70,Flash-LLM,1688.5,965.79532
9216,36864,16,5,40,SpInfer,2722.8,2395.68884
9216,36864,16,5,40,cuBLAS_TC,3547751.5,1.83862
9216,36864,16,5,40,Flash-LLM,1695.5,3847.23184
9216,36864,16,5,50,SpInfer,2680.8,2027.68501
9216,36864,16,5,50,cuBLAS_TC,3549705.2,1.53134
9216,36864,16,5,50,Flash-LLM,1712.1,3174.94187
9216,36864,16,5,60,SpInfer,2716.7,1600.71204
9216,36864,16,5,60,cuBLAS_TC,3550336.0,1.22486
9216,36864,16,5,60,Flash-LLM,1716.6,2533.29511
9216,36864,16,5,70,SpInfer,2699.3,1208.27281
9216,36864,16,5,70,cuBLAS_TC,3552813.0,0.91800
9216,36864,16,5,70,Flash-LLM,1694.4,1924.86473
9216,36864,32,5,40,SpInfer,2734.1,4771.57498
9216,36864,32,5,40,cuBLAS_TC,243.7,53532.88125
9216,36864,32,5,40,Flash-LLM,1726.5,7556.30649
9216,36864,32,5,50,SpInfer,2727.9,3985.34989
9216,36864,32,5,50,cuBLAS_TC,247.8,43872.62295
9216,36864,32,5,50,Flash-LLM,1690.9,6429.49670
9216,36864,32,5,60,SpInfer,2725.9,3190.61916
9216,36864,32,5,60,cuBLAS_TC,242.7,35835.63566
9216,36864,32,5,60,Flash-LLM,1703.4,5105.85228
9216,36864,32,5,70,SpInfer,2711.6,2405.58400
9216,36864,32,5,70,cuBLAS_TC,245.8,26537.76070
9216,36864,32,5,70,Flash-LLM,1704.9,3826.02005
36864,12288,8,2,40,SpInfer,2706.4,1606.80402
36864,12288,8,2,40,cuBLAS_TC,2289389.5,1.89948
36864,12288,8,2,40,Flash-LLM,1706.2,2548.73660
36864,12288,8,2,50,SpInfer,2744.3,1320.51112
36864,12288,8,2,50,cuBLAS_TC,2289335.2,1.58294
36864,12288,8,2,50,Flash-LLM,1697.5,2134.83279
36864,12288,8,2,60,SpInfer,2724.9,1063.93002
36864,12288,8,2,60,cuBLAS_TC,2289206.2,1.26642
36864,12288,8,2,60,Flash-LLM,1702.4,1702.95050
36864,12288,8,2,70,SpInfer,2740.2,793.49215
36864,12288,8,2,70,cuBLAS_TC,2289343.5,0.94976
36864,12288,8,2,70,Flash-LLM,1699.2,1279.61817
36864,12288,16,2,40,SpInfer,2692.1,3230.67820
36864,12288,16,2,40,cuBLAS_TC,4367217.5,1.99150
36864,12288,16,2,40,Flash-LLM,1721.5,5052.16891
36864,12288,16,2,50,SpInfer,2707.5,2676.91867
36864,12288,16,2,50,cuBLAS_TC,4362952.0,1.66120
36864,12288,16,2,50,Flash-LLM,1728.9,4192.12060
36864,12288,16,2,60,SpInfer,2710.5,2139.16467
36864,12288,16,2,60,cuBLAS_TC,4362481.5,1.32911
36864,12288,16,2,60,Flash-LLM,1706.2,3398.31547
36864,12288,16,2,70,SpInfer,2688.0,1617.80297
36864,12288,16,2,70,cuBLAS_TC,4355109.5,0.99852
36864,12288,16,2,70,Flash-LLM,1700.2,2557.73108
36864,12288,32,2,40,SpInfer,2695.2,6453.92459
36864,12288,32,2,40,cuBLAS_TC,244.7,71085.48242
36864,12288,32,2,40,Flash-LLM,1704.8,10203.31860
36864,12288,32,2,50,SpInfer,2697.2,5374.28245
36864,12288,32,2,50,cuBLAS_TC,244.7,59237.90202
36864,12288,32,2,50,Flash-LLM,1685.4,8600.63761
36864,12288,32,2,60,SpInfer,2680.8,4325.72803
36864,12288,32,2,60,cuBLAS_TC,245.8,47178.24125
36864,12288,32,2,60,Flash-LLM,1679.7,6903.85884
36864,12288,32,2,70,SpInfer,2681.9,3242.96535
36864,12288,32,2,70,cuBLAS_TC,249.9,34803.15636
36864,12288,32,2,70,Flash-LLM,1695.4,5129.94501
12288,12288,8,6,40,SpInfer,2694.1,538.04664
12288,12288,8,6,40,cuBLAS_TC,781373.4,1.85513
12288,12288,8,6,40,Flash-LLM,1712.2,846.60172
12288,12288,8,6,50,SpInfer,2727.9,442.81665
12288,12288,8,6,50,cuBLAS_TC,781533.2,1.54563
12288,12288,8,6,50,Flash-LLM,1713.5,704.96618
12288,12288,8,6,60,SpInfer,2693.1,358.83095
12288,12288,8,6,60,cuBLAS_TC,781425.6,1.23667
12288,12288,8,6,60,Flash-LLM,1696.4,569.65789
12288,12288,8,6,70,SpInfer,2706.4,267.80067
12288,12288,8,6,70,cuBLAS_TC,781333.5,0.92761
12288,12288,8,6,70,Flash-LLM,1694.8,427.64676
12288,12288,16,6,40,SpInfer,2699.3,1074.02027
12288,12288,16,6,40,cuBLAS_TC,1553187.9,1.86655
12288,12288,16,6,40,Flash-LLM,1707.4,1697.96353
12288,12288,16,6,50,SpInfer,2735.1,883.30193
12288,12288,16,6,50,cuBLAS_TC,1553163.1,1.55548
12288,12288,16,6,50,Flash-LLM,1719.9,1404.68580
12288,12288,16,6,60,SpInfer,2686.0,719.55893
12288,12288,16,6,60,cuBLAS_TC,1553315.8,1.24426
12288,12288,16,6,60,Flash-LLM,1697.2,1138.77874
12288,12288,16,6,70,SpInfer,2691.1,538.64645
12288,12288,16,6,70,cuBLAS_TC,1553127.4,0.93331
12288,12288,16,6,70,Flash-LLM,1706.3,849.52908
12288,12288,32,6,40,SpInfer,2693.1,2152.98572
12288,12288,32,6,40,cuBLAS_TC,244.7,23695.16081
12288,12288,32,6,40,Flash-LLM,1713.1,3384.62778
12288,12288,32,6,50,SpInfer,2692.1,1794.82122
12288,12288,32,6,50,cuBLAS_TC,247.8,19498.94354
12288,12288,32,6,50,Flash-LLM,1687.7,2862.97222
12288,12288,32,6,60,SpInfer,2678.8,1442.98588
12288,12288,32,6,60,cuBLAS_TC,245.8,15726.08042
12288,12288,32,6,60,Flash-LLM,1709.9,2260.64130
12288,12288,32,6,70,SpInfer,2672.6,1084.75003
12288,12288,32,6,70,cuBLAS_TC,243.7,11896.19583
12288,12288,32,6,70,Flash-LLM,1683.5,1722.06886
49152,12288,8,3,40,SpInfer,2718.7,2132.71264
49152,12288,8,3,40,cuBLAS_TC,2949999.5,1.96549
49152,12288,8,3,40,Flash-LLM,1700.6,3409.50597
49152,12288,8,3,50,SpInfer,2677.8,1804.40593
49152,12288,8,3,50,cuBLAS_TC,2949740.5,1.63806
49152,12288,8,3,50,Flash-LLM,1709.2,2826.95893
49152,12288,8,3,60,SpInfer,2682.9,1440.78071
49152,12288,8,3,60,cuBLAS_TC,2947001.5,1.31166
49152,12288,8,3,60,Flash-LLM,1704.9,2267.27114
49152,12288,8,3,70,SpInfer,2700.3,1073.62253
49152,12288,8,3,70,cuBLAS_TC,2948539.2,0.98323
49152,12288,8,3,70,Flash-LLM,1689.4,1716.05477
49152,12288,16,3,40,SpInfer,2987.0,3882.29384
49152,12288,16,3,40,cuBLAS_TC,5815028.5,1.99421
49152,12288,16,3,40,Flash-LLM,1700.8,6818.21008
49152,12288,16,3,50,SpInfer,2737.2,3530.49701
49152,12288,16,3,50,cuBLAS_TC,5815215.0,1.66179
49152,12288,16,3,50,Flash-LLM,1685.2,5734.43889
49152,12288,16,3,60,SpInfer,2707.5,2855.37992
49152,12288,16,3,60,cuBLAS_TC,5797406.5,1.33352
49152,12288,16,3,60,Flash-LLM,1699.0,4550.28907
49152,12288,16,3,70,SpInfer,2723.8,2128.71938
49152,12288,16,3,70,cuBLAS_TC,5796638.5,1.00027
49152,12288,16,3,70,Flash-LLM,1684.4,3442.29746
49152,12288,32,3,40,SpInfer,2717.7,8533.98955
49152,12288,32,3,40,cuBLAS_TC,244.7,94780.64323
49152,12288,32,3,40,Flash-LLM,1720.3,13481.84817
49152,12288,32,3,50,SpInfer,2724.9,7092.86683
49152,12288,32,3,50,cuBLAS_TC,244.7,78983.86936
49152,12288,32,3,50,Flash-LLM,1698.2,11381.08163
49152,12288,32,3,60,SpInfer,2751.5,5619.43749
49152,12288,32,3,60,cuBLAS_TC,244.7,63187.09549
49152,12288,32,3,60,Flash-LLM,1692.5,9135.52867
49152,12288,32,3,70,SpInfer,2706.4,4284.81071
49152,12288,32,3,70,cuBLAS_TC,244.7,47390.32162
49152,12288,32,3,70,Flash-LLM,1702.7,6810.60181
12288,49152,8,6,40,SpInfer,2746.4,2111.20225
12288,49152,8,6,40,cuBLAS_TC,2981271.5,1.94488
12288,49152,8,6,40,Flash-LLM,1701.2,3408.30346
12288,49152,8,6,50,SpInfer,2758.7,1751.49100
12288,49152,8,6,50,cuBLAS_TC,2981384.2,1.62067
12288,49152,8,6,50,Flash-LLM,1699.0,2843.93067
12288,49152,8,6,60,SpInfer,2740.2,1410.65271
12288,49152,8,6,60,cuBLAS_TC,2981878.8,1.29632
12288,49152,8,6,60,Flash-LLM,1703.9,2268.60178
12288,49152,8,6,70,SpInfer,2798.6,1035.91186
12288,49152,8,6,70,cuBLAS_TC,2981881.0,0.97224
12288,49152,8,6,70,Flash-LLM,1708.8,1696.57240
12288,49152,16,6,40,SpInfer,2748.4,4219.33187
12288,49152,16,6,40,cuBLAS_TC,5940734.0,1.95202
12288,49152,16,6,40,Flash-LLM,1718.7,6747.19945
12288,49152,16,6,50,SpInfer,2732.0,3537.21684
12288,49152,16,6,50,cuBLAS_TC,5939221.0,1.62709
12288,49152,16,6,50,Flash-LLM,1718.4,5623.64782
12288,49152,16,6,60,SpInfer,2705.4,2857.59634
12288,49152,16,6,60,cuBLAS_TC,5932367.0,1.30318
12288,49152,16,6,60,Flash-LLM,1714.1,4510.20427
12288,49152,16,6,70,SpInfer,2694.1,2152.18657
12288,49152,16,6,70,cuBLAS_TC,5923513.5,0.97885
12288,49152,16,6,70,Flash-LLM,1688.4,3434.14229
12288,49152,32,6,40,SpInfer,2776.1,8354.46252
12288,49152,32,6,40,cuBLAS_TC,245.8,94356.48250
12288,49152,32,6,40,Flash-LLM,1700.3,13640.43016
12288,49152,32,6,50,SpInfer,2732.0,7074.43369
12288,49152,32,6,50,cuBLAS_TC,245.8,78630.40208
12288,49152,32,6,50,Flash-LLM,1696.9,11389.80071
12288,49152,32,6,60,SpInfer,2692.1,5743.42791
12288,49152,32,6,60,cuBLAS_TC,251.9,61381.03321
12288,49152,32,6,60,Flash-LLM,1691.7,9139.84883
12288,49152,32,6,70,SpInfer,2709.5,4279.90836
12288,49152,32,6,70,cuBLAS_TC,244.7,47390.32162
12288,49152,32,6,70,Flash-LLM,1710.7,6778.75238
