kernel_benchmark/main_res.csv
M,K,N,SplitK,Sparsity,Kernel,Duration(ns),TFLOPS
8192,29568,8,7,40,SpInfer,2825.2,1371.76648
8192,29568,8,7,40,cuBLAS_TC,1184850.9,3.27091
8192,29568,8,7,40,Flash-LLM,1714.1,2260.95898
8192,29568,8,7,50,SpInfer,2775.0,1396.56970
8192,29568,8,7,50,cuBLAS_TC,1184755.6,3.27117
8192,29568,8,7,50,Flash-LLM,1696.6,2284.32837
8192,29568,8,7,60,SpInfer,2785.3,1391.43530
8192,29568,8,7,60,cuBLAS_TC,1184888.9,3.27080
8192,29568,8,7,60,Flash-LLM,1685.0,2300.07642
8192,29568,8,7,70,SpInfer,2746.4,1411.15002
8192,29568,8,7,70,cuBLAS_TC,1184653.2,3.27145
8192,29568,8,7,70,Flash-LLM,1689.3,2294.19458
8192,29568,16,7,40,SpInfer,2720.8,2848.85522
8192,29568,16,7,40,cuBLAS_TC,2350274.5,3.29794
8192,29568,16,7,40,Flash-LLM,1749.1,4431.49414
8192,29568,16,7,50,SpInfer,2743.3,2825.46045
8192,29568,16,7,50,cuBLAS_TC,2350704.8,3.29734
8192,29568,16,7,50,Flash-LLM,1682.8,4605.92627
8192,29568,16,7,60,SpInfer,2709.5,2860.69849
8192,29568,16,7,60,cuBLAS_TC,2350440.5,3.29771
8192,29568,16,7,60,Flash-LLM,1684.9,4600.41504
8192,29568,16,7,70,SpInfer,2737.2,2831.80225
8192,29568,16,7,70,cuBLAS_TC,2350255.0,3.29797
8192,29568,16,7,70,Flash-LLM,1690.9,4583.96045
8192,29568,32,7,40,SpInfer,2723.8,5691.28418
8192,29568,32,7,40,cuBLAS_TC,242.7,63876.86328
8192,29568,32,7,40,Flash-LLM,1685.3,9198.20996
8192,29568,32,7,50,SpInfer,2730.0,5678.47559
8192,29568,32,7,50,cuBLAS_TC,243.7,63608.47266
8192,29568,32,7,50,Flash-LLM,1699.6,9120.79883
8192,29568,32,7,60,SpInfer,2705.4,5730.05908
8192,29568,32,7,60,cuBLAS_TC,243.7,63608.47266
8192,29568,32,7,60,Flash-LLM,1690.6,9169.83008
8192,29568,32,7,70,SpInfer,2720.8,5697.71045
8192,29568,32,7,70,cuBLAS_TC,245.8,63078.40234
8192,29568,32,7,70,Flash-LLM,1685.4,9198.03516
4096,4096,8,7,40,SpInfer,2657.3,101.01888
4096,4096,8,7,40,cuBLAS_TC,98845.7,2.71570
4096,4096,8,7,40,Flash-LLM,1711.1,156.87851
4096,4096,8,7,50,SpInfer,2742.3,97.88798
4096,4096,8,7,50,cuBLAS_TC,98093.1,2.73654
4096,4096,8,7,50,Flash-LLM,1698.8,158.01326
4096,4096,8,7,60,SpInfer,2661.4,100.86341
4096,4096,8,7,60,cuBLAS_TC,93358.1,2.87533
4096,4096,8,7,60,Flash-LLM,1711.1,156.87851
4096,4096,8,7,70,SpInfer,2727.9,98.40240
4096,4096,8,7,70,cuBLAS_TC,93625.3,2.86712
4096,4096,8,7,70,Flash-LLM,1697.8,158.10855
4096,4096,16,7,40,SpInfer,2630.7,204.08252
4096,4096,16,7,40,cuBLAS_TC,172227.6,3.11722
4096,4096,16,7,40,Flash-LLM,1689.6,317.75031
4096,4096,16,7,50,SpInfer,2635.8,203.68608
4096,4096,16,7,50,cuBLAS_TC,172687.4,3.10892
4096,4096,16,7,50,Flash-LLM,1688.6,317.94299
4096,4096,16,7,60,SpInfer,2674.7,200.72281
4096,4096,16,7,60,cuBLAS_TC,172066.8,3.12013
4096,4096,16,7,60,Flash-LLM,1694.7,316.79034
4096,4096,16,7,70,SpInfer,2729.0,196.73096
4096,4096,16,7,70,cuBLAS_TC,172513.3,3.11206
4096,4096,16,7,70,Flash-LLM,1720.3,312.07620
4096,4096,32,7,40,SpInfer,2645.0,405.95273
4096,4096,32,7,40,cuBLAS_TC,244.7,4387.34717
4096,4096,32,7,40,Flash-LLM,1679.4,639.37561
4096,4096,32,7,50,SpInfer,2632.7,407.84750
4096,4096,32,7,50,cuBLAS_TC,244.7,4387.34717
4096,4096,32,7,50,Flash-LLM,1692.7,634.34723
4096,4096,32,7,60,SpInfer,2630.7,408.16504
4096,4096,32,7,60,cuBLAS_TC,244.7,4387.34717
4096,4096,32,7,60,Flash-LLM,1724.4,622.66980
4096,4096,32,7,70,SpInfer,2620.4,409.76007
4096,4096,32,7,70,cuBLAS_TC,245.8,4369.06689
4096,4096,32,7,70,Flash-LLM,1676.3,640.54736
32000,5120,8,3,40,SpInfer,2688.0,975.23810
32000,5120,8,3,40,cuBLAS_TC,795571.2,3.29504
32000,5120,8,3,40,Flash-LLM,1705.0,1537.50867
32000,5120,8,3,50,SpInfer,2693.1,973.38403
32000,5120,8,3,50,cuBLAS_TC,791638.0,3.31141
32000,5120,8,3,50,Flash-LLM,1696.7,1545.01904
32000,5120,8,3,60,SpInfer,2702.3,970.06439
32000,5120,8,3,60,cuBLAS_TC,791229.4,3.31312
32000,5120,8,3,60,Flash-LLM,1698.4,1543.47620
32000,5120,8,3,70,SpInfer,2690.0,974.49567
32000,5120,8,3,70,cuBLAS_TC,790777.8,3.31501
32000,5120,8,3,70,Flash-LLM,1694.4,1547.09070
32000,5120,16,3,40,SpInfer,2672.6,1961.68567
32000,5120,16,3,40,cuBLAS_TC,1549691.9,3.38318
32000,5120,16,3,40,Flash-LLM,1690.9,3100.62256
32000,5120,16,3,50,SpInfer,2691.1,1948.24963
32000,5120,16,3,50,cuBLAS_TC,1549324.4,3.38398
32000,5120,16,3,50,Flash-LLM,1703.4,3077.90576
32000,5120,16,3,60,SpInfer,2727.9,1921.92188
32000,5120,16,3,60,cuBLAS_TC,1546615.9,3.38990
32000,5120,16,3,60,Flash-LLM,1691.5,3099.62549
32000,5120,16,3,70,SpInfer,2681.9,1954.94482
32000,5120,16,3,70,cuBLAS_TC,1546024.0,3.39120
32000,5120,16,3,70,Flash-LLM,1680.7,3119.45483
32000,5120,32,3,40,SpInfer,2680.8,3911.38306
32000,5120,32,3,40,cuBLAS_TC,244.7,42845.18750
32000,5120,32,3,40,Flash-LLM,1687.1,6215.36035
32000,5120,32,3,50,SpInfer,2677.8,3915.87012
32000,5120,32,3,50,cuBLAS_TC,302.1,34711.86328
32000,5120,32,3,50,Flash-LLM,1695.5,6184.39160
32000,5120,32,3,60,SpInfer,2699.3,3884.67358
32000,5120,32,3,60,cuBLAS_TC,255.0,41124.49609
32000,5120,32,3,60,Flash-LLM,1713.1,6121.08398
32000,5120,32,3,70,SpInfer,2678.8,3914.37329
32000,5120,32,3,70,cuBLAS_TC,244.7,42845.18750
32000,5120,32,3,70,Flash-LLM,1709.1,6135.41064
32000,8192,8,3,40,SpInfer,2705.4,1550.34058
32000,8192,8,3,40,cuBLAS_TC,1190995.0,3.52168
32000,8192,8,3,40,Flash-LLM,1709.6,2453.38330
32000,8192,8,3,50,SpInfer,2730.0,1536.38416
32000,8192,8,3,50,cuBLAS_TC,1184916.5,3.53975
32000,8192,8,3,50,Flash-LLM,1700.2,2467.00537
32000,8192,8,3,60,SpInfer,2724.9,1539.27087
32000,8192,8,3,60,cuBLAS_TC,1183942.6,3.54266
32000,8192,8,3,60,Flash-LLM,1720.1,2438.36719
32000,8192,8,3,70,SpInfer,2745.3,1527.78821
32000,8192,8,3,70,cuBLAS_TC,1175738.5,3.56738
32000,8192,8,3,70,Flash-LLM,1675.1,2503.85889
32000,8192,16,3,40,SpInfer,2696.2,3111.27979
32000,8192,16,3,40,cuBLAS_TC,2326264.0,3.60604
32000,8192,16,3,40,Flash-LLM,1701.2,4930.85547
32000,8192,16,3,50,SpInfer,2693.1,3114.82910
32000,8192,16,3,50,cuBLAS_TC,2326149.2,3.60622
32000,8192,16,3,50,Flash-LLM,1698.3,4939.31006
32000,8192,16,3,60,SpInfer,2698.2,3108.91821
32000,8192,16,3,60,cuBLAS_TC,2325398.5,3.60739
32000,8192,16,3,60,Flash-LLM,1705.9,4917.53613
32000,8192,16,3,70,SpInfer,2689.0,3119.57349
32000,8192,16,3,70,cuBLAS_TC,2323948.5,3.60964
32000,8192,16,3,70,Flash-LLM,1699.8,4935.12549
32000,8192,32,3,40,SpInfer,2720.8,6166.35352
32000,8192,32,3,40,cuBLAS_TC,245.8,68266.67188
32000,8192,32,3,40,Flash-LLM,1689.2,9932.33105
32000,8192,32,3,50,SpInfer,2747.4,6106.59717
32000,8192,32,3,50,cuBLAS_TC,254.0,66064.51562
32000,8192,32,3,50,Flash-LLM,1690.4,9925.18555
32000,8192,32,3,60,SpInfer,2674.7,6272.58789
32000,8192,32,3,60,cuBLAS_TC,259.1,64758.89453
32000,8192,32,3,60,Flash-LLM,1692.0,9915.79980
32000,8192,32,3,70,SpInfer,2754.6,6090.70654
32000,8192,32,3,70,cuBLAS_TC,243.7,68840.33594
32000,8192,32,3,70,Flash-LLM,1689.9,9928.19238
28672,8192,8,4,40,SpInfer,2721.8,1380.74341
28672,8192,8,4,40,cuBLAS_TC,1058360.4,3.55087
28672,8192,8,4,40,Flash-LLM,1694.0,2218.49585
28672,8192,8,4,50,SpInfer,2717.7,1382.82446
28672,8192,8,4,50,cuBLAS_TC,1057477.8,3.55383
28672,8192,8,4,50,Flash-LLM,1710.2,2197.40869
28672,8192,8,4,60,SpInfer,2721.8,1380.74341
28672,8192,8,4,60,cuBLAS_TC,1057467.5,3.55386
28672,8192,8,4,60,Flash-LLM,1703.3,2206.40869
28672,8192,8,4,70,SpInfer,2708.5,1387.52966
28672,8192,8,4,70,cuBLAS_TC,1050699.9,3.57676
28672,8192,8,4,70,Flash-LLM,1687.1,2227.58496
28672,8192,16,4,40,SpInfer,2701.3,2782.42310
28672,8192,16,4,40,cuBLAS_TC,2087736.4,3.60016
28672,8192,16,4,40,Flash-LLM,1696.8,4429.71143
28672,8192,16,4,50,SpInfer,2708.5,2775.05933
28672,8192,16,4,50,cuBLAS_TC,2087943.1,3.59981
28672,8192,16,4,50,Flash-LLM,1680.3,4473.15723
28672,8192,16,4,60,SpInfer,2695.2,2788.76611
28672,8192,16,4,60,cuBLAS_TC,2086132.8,3.60293
28672,8192,16,4,60,Flash-LLM,1685.3,4459.90723
28672,8192,16,4,70,SpInfer,2725.9,2757.33740
28672,8192,16,4,70,cuBLAS_TC,2083628.0,3.60726
28672,8192,16,4,70,Flash-LLM,1693.1,4439.25586
28672,8192,32,4,40,SpInfer,2712.6,5541.73828
28672,8192,32,4,40,cuBLAS_TC,244.7,61422.86328
28672,8192,32,4,40,Flash-LLM,1694.3,8872.30762
28672,8192,32,4,50,SpInfer,2687.0,5594.53662
28672,8192,32,4,50,cuBLAS_TC,244.7,61422.86328
28672,8192,32,4,50,Flash-LLM,1698.6,8849.74316
28672,8192,32,4,60,SpInfer,2692.1,5583.89648
28672,8192,32,4,60,cuBLAS_TC,244.7,61422.86328
28672,8192,32,4,60,Flash-LLM,1742.3,8628.03613
28672,8192,32,4,70,SpInfer,2756.6,5453.21875
28672,8192,32,4,70,cuBLAS_TC,244.7,61422.86328
28672,8192,32,4,70,Flash-LLM,1709.8,8792.10352
5120,5120,8,5,40,SpInfer,2713.6,154.56604
5120,5120,8,5,40,cuBLAS_TC,175159.3,2.39457
5120,5120,8,5,40,Flash-LLM,1703.9,246.15384
5120,5120,8,5,50,SpInfer,2698.2,155.44591
5120,5120,8,5,50,cuBLAS_TC,176244.7,2.37982
5120,5120,8,5,50,Flash-LLM,1708.0,245.56355
5120,5120,8,5,60,SpInfer,2718.7,154.27496
5120,5120,8,5,60,cuBLAS_TC,167953.4,2.49730
5120,5120,8,5,60,Flash-LLM,1676.3,250.21381
5120,5120,8,5,70,SpInfer,2701.3,155.26913
5120,5120,8,5,70,cuBLAS_TC,168428.5,2.49026
5120,5120,8,5,70,Flash-LLM,1683.5,249.14844
5120,5120,16,5,40,SpInfer,2703.4,310.30304
5120,5120,16,5,40,cuBLAS_TC,285052.9,2.94282
5120,5120,16,5,40,Flash-LLM,1707.0,491.42172
5120,5120,16,5,50,SpInfer,2723.8,307.96991
5120,5120,16,5,50,cuBLAS_TC,285459.4,2.93863
5120,5120,16,5,50,Flash-LLM,1686.5,497.38919
5120,5120,16,5,60,SpInfer,2702.3,310.42059
5120,5120,16,5,60,cuBLAS_TC,286842.8,2.92446
5120,5120,16,5,60,Flash-LLM,1711.1,490.24533
5120,5120,16,5,70,SpInfer,2716.7,308.78253
5120,5120,16,5,70,cuBLAS_TC,285120.5,2.94213
5120,5120,16,5,70,Flash-LLM,1698.8,493.79144
5120,5120,32,5,40,SpInfer,2642.9,634.79272
5120,5120,32,5,40,cuBLAS_TC,245.8,6826.66699
5120,5120,32,5,40,Flash-LLM,1678.3,999.63391
5120,5120,32,5,50,SpInfer,2657.3,631.36798
5120,5120,32,5,50,cuBLAS_TC,244.7,6855.22998
5120,5120,32,5,50,Flash-LLM,1696.8,988.77484
5120,5120,32,5,60,SpInfer,2657.3,631.36798
5120,5120,32,5,60,cuBLAS_TC,245.8,6826.66699
5120,5120,32,5,60,Flash-LLM,1720.3,975.23810
5120,5120,32,5,70,SpInfer,2673.7,627.49902
5120,5120,32,5,70,cuBLAS_TC,242.7,6913.08008
5120,5120,32,5,70,Flash-LLM,1705.0,984.02399
5120,13824,8,5,40,SpInfer,2825.2,400.84085
5120,13824,8,5,40,cuBLAS_TC,476255.2,2.37785
5120,13824,8,5,40,Flash-LLM,1723.4,657.11230
5120,13824,8,5,50,SpInfer,2753.5,411.27557
5120,13824,8,5,50,cuBLAS_TC,476367.9,2.37728
5120,13824,8,5,50,Flash-LLM,1685.5,671.88336
5120,13824,8,5,60,SpInfer,2751.5,411.58170
5120,13824,8,5,60,cuBLAS_TC,476241.9,2.37791
5120,13824,8,5,60,Flash-LLM,1709.1,662.62433
5120,13824,8,5,70,SpInfer,2718.7,416.54239
5120,13824,8,5,70,cuBLAS_TC,476453.9,2.37686
5120,13824,8,5,70,Flash-LLM,1686.5,671.47540
5120,13824,16,5,40,SpInfer,2683.9,843.89166
5120,13824,16,5,40,cuBLAS_TC,798141.4,2.83775
5120,13824,16,5,40,Flash-LLM,1693.7,1337.26721
5120,13824,16,5,50,SpInfer,2693.1,841.00385
5120,13824,16,5,50,cuBLAS_TC,796939.2,2.84203
5120,13824,16,5,50,Flash-LLM,1699.8,1332.43372
5120,13824,16,5,60,SpInfer,2708.5,836.23444
5120,13824,16,5,60,cuBLAS_TC,798775.2,2.83550
5120,13824,16,5,60,Flash-LLM,1722.4,1315.00598
5120,13824,16,5,70,SpInfer,2696.2,840.04553
5120,13824,16,5,70,cuBLAS_TC,798122.0,2.83782
5120,13824,16,5,70,Flash-LLM,1696.8,1334.84607
5120,13824,32,5,40,SpInfer,2709.5,1671.83679
5120,13824,32,5,40,cuBLAS_TC,247.8,18279.66992
5120,13824,32,5,40,Flash-LLM,1689.6,2681.01831
5120,13824,32,5,50,SpInfer,2694.1,1681.36841
5120,13824,32,5,50,cuBLAS_TC,244.7,18509.12109
5120,13824,32,5,50,Flash-LLM,1691.6,2677.77222
5120,13824,32,5,60,SpInfer,2699.3,1678.17896
5120,13824,32,5,60,cuBLAS_TC,244.7,18509.12109
5120,13824,32,5,60,Flash-LLM,1685.5,2687.53345
5120,13824,32,5,70,SpInfer,2681.9,1689.07227
5120,13824,32,5,70,cuBLAS_TC,255.0,17765.78320
5120,13824,32,5,70,Flash-LLM,1683.5,2690.80298
3584,20480,8,7,40,SpInfer,2739.2,428.74017
3584,20480,8,7,40,cuBLAS_TC,403123.2,2.91327
3584,20480,8,7,40,Flash-LLM,1692.7,693.81726
3584,20480,8,7,50,SpInfer,2737.2,429.06094
3584,20480,8,7,50,cuBLAS_TC,403078.2,2.91359
3584,20480,8,7,50,Flash-LLM,1693.7,693.39783
3584,20480,8,7,60,SpInfer,2750.5,426.98438
3584,20480,8,7,60,cuBLAS_TC,403661.8,2.90938
3584,20480,8,7,60,Flash-LLM,1695.7,692.56036
3584,20480,8,7,70,SpInfer,2752.5,426.66666
3584,20480,8,7,70,cuBLAS_TC,403210.2,2.91264
3584,20480,8,7,70,Flash-LLM,1731.6,678.22589
3584,20480,16,7,40,SpInfer,2690.0,873.14807
3584,20480,16,7,40,cuBLAS_TC,800998.4,2.93235
3584,20480,16,7,40,Flash-LLM,1698.8,1382.61609
3584,20480,16,7,50,SpInfer,2708.5,867.20605
3584,20480,16,7,50,cuBLAS_TC,801596.4,2.93017
3584,20480,16,7,50,Flash-LLM,1698.8,1382.61609
3584,20480,16,7,60,SpInfer,2675.7,877.82623
3584,20480,16,7,60,cuBLAS_TC,802343.9,2.92744
3584,20480,16,7,60,Flash-LLM,1675.3,1402.05383
3584,20480,16,7,70,SpInfer,2742.3,856.51984
3584,20480,16,7,70,cuBLAS_TC,801161.2,2.93176
3584,20480,16,7,70,Flash-LLM,1683.5,1395.23120
3584,20480,32,7,40,SpInfer,2719.7,1727.22900
3584,20480,32,7,40,cuBLAS_TC,244.7,19194.64453
3584,20480,32,7,40,Flash-LLM,1757.2,2673.37988
3584,20480,32,7,50,SpInfer,2715.6,1729.83411
3584,20480,32,7,50,cuBLAS_TC,243.7,19275.29492
3584,20480,32,7,50,Flash-LLM,1706.0,2753.61353
3584,20480,32,7,60,SpInfer,2724.9,1723.98340
3584,20480,32,7,60,cuBLAS_TC,244.7,19194.64453
3584,20480,32,7,60,Flash-LLM,1699.8,2763.56641
3584,20480,32,7,70,SpInfer,2692.1,1744.96765
3584,20480,32,7,70,cuBLAS_TC,248.8,18878.68359
3584,20480,32,7,70,Flash-LLM,1706.0,2753.61353
4096,11008,8,7,40,SpInfer,2709.5,266.25549
4096,11008,8,7,40,cuBLAS_TC,236035.1,3.05641
4096,11008,8,7,40,Flash-LLM,1685.5,428.01459
4096,11008,8,7,50,SpInfer,2712.6,265.95395
4096,11008,8,7,50,cuBLAS_TC,233825.3,3.08530
4096,11008,8,7,50,Flash-LLM,1693.7,425.94437
4096,11008,8,7,60,SpInfer,2717.7,265.45291
4096,11008,8,7,60,cuBLAS_TC,233438.2,3.09041
4096,11008,8,7,60,Flash-LLM,1695.7,425.42996
4096,11008,8,7,70,SpInfer,2724.9,264.75461
4096,11008,8,7,70,cuBLAS_TC,233161.7,3.09408
4096,11008,8,7,70,Flash-LLM,1688.6,427.23590
4096,11008,16,7,40,SpInfer,2657.3,542.97650
4096,11008,16,7,40,cuBLAS_TC,449870.8,3.20723
4096,11008,16,7,40,Flash-LLM,1696.8,850.34637
4096,11008,16,7,50,SpInfer,2671.6,540.06281
4096,11008,16,7,50,cuBLAS_TC,449157.2,3.21233
4096,11008,16,7,50,Flash-LLM,1691.6,852.92010
4096,11008,16,7,60,SpInfer,2669.6,540.47711
4096,11008,16,7,60,cuBLAS_TC,449420.3,3.21045
4096,11008,16,7,60,Flash-LLM,1692.7,852.40411
4096,11008,16,7,70,SpInfer,2670.6,540.26990
4096,11008,16,7,70,cuBLAS_TC,449347.6,3.21097
4096,11008,16,7,70,Flash-LLM,1685.5,856.02917
4096,11008,32,7,40,SpInfer,2684.9,1074.77039
4096,11008,32,7,40,cuBLAS_TC,248.8,11596.90625
4096,11008,32,7,40,Flash-LLM,1692.7,1704.80823
4096,11008,32,7,50,SpInfer,2689.0,1073.13330
4096,11008,32,7,50,cuBLAS_TC,245.8,11741.86719
4096,11008,32,7,50,Flash-LLM,1691.6,1705.84021
4096,11008,32,7,60,SpInfer,2678.8,1077.23560
4096,11008,32,7,60,cuBLAS_TC,244.7,11790.99609
4096,11008,32,7,60,Flash-LLM,1683.5,1714.14124
4096,11008,32,7,70,SpInfer,2690.0,1072.72485
4096,11008,32,7,70,cuBLAS_TC,252.9,11409.10156
4096,11008,32,7,70,Flash-LLM,1739.8,1658.65100
13824,5120,8,3,40,SpInfer,2768.9,408.99408
13824,5120,8,3,40,cuBLAS_TC,370725.9,3.05472
13824,5120,8,3,40,Flash-LLM,1686.5,671.47540
13824,5120,8,3,50,SpInfer,2751.5,411.58170
13824,5120,8,3,50,cuBLAS_TC,371490.8,3.04843
13824,5120,8,3,50,Flash-LLM,1695.7,667.82611
13824,5120,8,3,60,SpInfer,2823.2,401.13168
13824,5120,8,3,60,cuBLAS_TC,371156.0,3.05118
13824,5120,8,3,60,Flash-LLM,1712.1,661.43536
13824,5120,8,3,70,SpInfer,2724.9,415.60315
13824,5120,8,3,70,cuBLAS_TC,370469.9,3.05683
13824,5120,8,3,70,Flash-LLM,1711.1,661.83124
13824,5120,16,3,40,SpInfer,2700.3,838.77130
13824,5120,16,3,40,cuBLAS_TC,687047.7,3.29660
13824,5120,16,3,40,Flash-LLM,1715.2,1320.50159
13824,5120,16,3,50,SpInfer,2703.4,837.81818
13824,5120,16,3,50,cuBLAS_TC,687622.1,3.29385
13824,5120,16,3,50,Flash-LLM,1686.5,1342.95081
13824,5120,16,3,60,SpInfer,2718.7,833.08478
13824,5120,16,3,60,cuBLAS_TC,685871.1,3.30226
13824,5120,16,3,60,Flash-LLM,1713.2,1322.08008
13824,5120,16,3,70,SpInfer,2712.6,834.97168
13824,5120,16,3,70,cuBLAS_TC,685874.2,3.30224
13824,5120,16,3,70,Flash-LLM,1685.5,1343.76672
13824,5120,32,3,40,SpInfer,2744.3,1650.62695
13824,5120,32,3,40,cuBLAS_TC,244.7,18509.12109
13824,5120,32,3,40,Flash-LLM,1715.2,2641.00317
13824,5120,32,3,50,SpInfer,2707.5,1673.10132
13824,5120,32,3,50,cuBLAS_TC,244.7,18509.12109
13824,5120,32,3,50,Flash-LLM,1706.0,2655.27002
13824,5120,32,3,60,SpInfer,2690.0,1683.92847
13824,5120,32,3,60,cuBLAS_TC,246.8,18355.51758
13824,5120,32,3,60,Flash-LLM,1693.7,2674.53442
13824,5120,32,3,70,SpInfer,2702.3,1676.27124
13824,5120,32,3,70,cuBLAS_TC,244.7,18509.12109
13824,5120,32,3,70,Flash-LLM,1702.9,2660.06030
8192,8192,8,7,40,SpInfer,2702.3,397.33838
8192,8192,8,7,40,cuBLAS_TC,327408.7,3.27952
8192,8192,8,7,40,Flash-LLM,1705.0,629.77539
8192,8192,8,7,50,SpInfer,2731.0,393.16687
8192,8192,8,7,50,cuBLAS_TC,327002.1,3.28359
8192,8192,8,7,50,Flash-LLM,1689.6,635.50061
8192,8192,8,7,60,SpInfer,2708.5,396.43704
8192,8192,8,7,60,cuBLAS_TC,326677.5,3.28686
8192,8192,8,7,60,Flash-LLM,1687.6,636.27185
8192,8192,8,7,70,SpInfer,2711.6,395.98792
8192,8192,8,7,70,cuBLAS_TC,326310.9,3.29055
8192,8192,8,7,70,Flash-LLM,1724.4,622.66980
8192,8192,16,7,40,SpInfer,2658.3,807.83972
8192,8192,16,7,40,cuBLAS_TC,618086.4,3.47441
8192,8192,16,7,40,Flash-LLM,1691.6,1269.46240
8192,8192,16,7,50,SpInfer,2675.7,802.58398
8192,8192,16,7,50,cuBLAS_TC,617755.6,3.47627
8192,8192,16,7,50,Flash-LLM,1702.9,1261.06555
8192,8192,16,7,60,SpInfer,2700.3,795.27948
8192,8192,16,7,60,cuBLAS_TC,616932.4,3.48091
8192,8192,16,7,60,Flash-LLM,1705.0,1259.55078
8192,8192,16,7,70,SpInfer,2700.3,795.27948
8192,8192,16,7,70,cuBLAS_TC,614083.5,3.49705
8192,8192,16,7,70,Flash-LLM,1715.2,1252.03113
8192,8192,32,7,40,SpInfer,2669.6,1608.86218
8192,8192,32,7,40,cuBLAS_TC,243.7,17623.12695
8192,8192,32,7,40,Flash-LLM,1712.1,2508.55493
8192,8192,32,7,50,SpInfer,2701.3,1589.95593
8192,8192,32,7,50,cuBLAS_TC,244.7,17549.38867
8192,8192,32,7,50,Flash-LLM,1714.2,2505.55786
8192,8192,32,7,60,SpInfer,2717.7,1580.37085
8192,8192,32,7,60,cuBLAS_TC,248.8,17260.51172
8192,8192,32,7,60,Flash-LLM,1726.5,2487.72485
8192,8192,32,7,70,SpInfer,2675.7,1605.16797
8192,8192,32,7,70,cuBLAS_TC,245.8,17476.26758
8192,8192,32,7,70,Flash-LLM,1679.4,2557.50244
18944,3584,8,7,40,SpInfer,2718.7,399.57214
18944,3584,8,7,40,cuBLAS_TC,335207.4,3.24075
18944,3584,8,7,40,Flash-LLM,1694.7,641.00543
18944,3584,8,7,50,SpInfer,2692.1,403.52377
18944,3584,8,7,50,cuBLAS_TC,336040.9,3.23272
18944,3584,8,7,50,Flash-LLM,1714.2,633.72998
18944,3584,8,7,60,SpInfer,2721.8,399.12112
18944,3584,8,7,60,cuBLAS_TC,335444.0,3.23847
18944,3584,8,7,60,Flash-LLM,1707.0,636.39111
18944,3584,8,7,70,SpInfer,2694.1,403.21704
18944,3584,8,7,70,cuBLAS_TC,335586.3,3.23709
18944,3584,8,7,70,Flash-LLM,1685.5,644.51031
18944,3584,16,7,40,SpInfer,2709.5,801.86243
18944,3584,16,7,40,cuBLAS_TC,649565.2,3.34478
18944,3584,16,7,40,Flash-LLM,1708.0,1272.01917
18944,3584,16,7,50,SpInfer,2736.1,794.05981
18944,3584,16,7,50,cuBLAS_TC,647629.8,3.35477
18944,3584,16,7,50,Flash-LLM,1694.7,1282.01086
18944,3584,16,7,60,SpInfer,2730.0,795.84698
18944,3584,16,7,60,cuBLAS_TC,646414.2,3.36108
18944,3584,16,7,60,Flash-LLM,1687.6,1287.45630
18944,3584,16,7,70,SpInfer,2700.3,804.59912
18944,3584,16,7,70,cuBLAS_TC,645262.3,3.36708
18944,3584,16,7,70,Flash-LLM,1681.4,1292.16077
18944,3584,32,7,40,SpInfer,2681.9,1620.25818
18944,3584,32,7,40,cuBLAS_TC,246.8,17607.70117
18944,3584,32,7,40,Flash-LLM,1710.1,2540.99146
18944,3584,32,7,50,SpInfer,2727.9,1592.88892
18944,3584,32,7,50,cuBLAS_TC,249.9,17391.21289
18944,3584,32,7,50,Flash-LLM,1687.6,2574.91260
18944,3584,32,7,60,SpInfer,2690.0,1615.32397
18944,3584,32,7,60,cuBLAS_TC,247.8,17534.94141
18944,3584,32,7,60,Flash-LLM,1684.5,2579.60840
18944,3584,32,7,70,SpInfer,2689.0,1615.93909
18944,3584,32,7,70,cuBLAS_TC,248.8,17462.78320
18944,3584,32,7,70,Flash-LLM,1706.0,2547.09253
14336,4096,8,7,40,SpInfer,2675.7,351.13049
14336,4096,8,7,40,cuBLAS_TC,288768.0,3.25356
14336,4096,8,7,40,Flash-LLM,1687.6,556.73785
14336,4096,8,7,50,SpInfer,2660.4,353.15781
14336,4096,8,7,50,cuBLAS_TC,289080.3,3.25005
14336,4096,8,7,50,Flash-LLM,1678.3,559.79498
14336,4096,8,7,60,SpInfer,2679.8,350.59384
14336,4096,8,7,60,cuBLAS_TC,288327.7,3.25853
14336,4096,8,7,60,Flash-LLM,1694.7,554.38306
14336,4096,8,7,70,SpInfer,2669.6,351.93860
14336,4096,8,7,70,cuBLAS_TC,289975.3,3.24001
14336,4096,8,7,70,Flash-LLM,1709.1,549.73279
14336,4096,16,7,40,SpInfer,2664.4,705.22980
14336,4096,16,7,40,cuBLAS_TC,545215.5,3.44643
14336,4096,16,7,40,Flash-LLM,1713.2,1096.83679
14336,4096,16,7,50,SpInfer,2678.8,701.45569
14336,4096,16,7,50,cuBLAS_TC,544119.8,3.45337
14336,4096,16,7,50,Flash-LLM,1682.4,1116.86426
14336,4096,16,7,60,SpInfer,2648.1,709.59320
14336,4096,16,7,60,cuBLAS_TC,541571.0,3.46962
14336,4096,16,7,60,Flash-LLM,1678.3,1119.58997
14336,4096,16,7,70,SpInfer,2661.4,706.04388
14336,4096,16,7,70,cuBLAS_TC,542058.4,3.46650
14336,4096,16,7,70,Flash-LLM,1710.1,1098.80713
14336,4096,32,7,40,SpInfer,2664.4,1410.45959
14336,4096,32,7,40,cuBLAS_TC,244.7,15355.71582
14336,4096,32,7,40,Flash-LLM,1692.7,2220.21533
14336,4096,32,7,50,SpInfer,2663.4,1411.00195
14336,4096,32,7,50,cuBLAS_TC,243.7,15420.23535
14336,4096,32,7,50,Flash-LLM,1690.6,2222.90479
14336,4096,32,7,60,SpInfer,2719.7,1381.78320
14336,4096,32,7,60,cuBLAS_TC,244.7,15355.71582
14336,4096,32,7,60,Flash-LLM,1682.4,2233.72852
14336,4096,32,7,70,SpInfer,2704.4,1389.63123
14336,4096,32,7,70,cuBLAS_TC,245.8,15291.73340
14336,4096,32,7,70,Flash-LLM,1686.5,2228.30371
4096,14336,8,7,40,SpInfer,2722.8,345.05603
4096,14336,8,7,40,cuBLAS_TC,296375.3,3.17005
4096,14336,8,7,40,Flash-LLM,1721.3,545.80847
4096,14336,8,7,50,SpInfer,2731.0,344.02100
4096,14336,8,7,50,cuBLAS_TC,296343.6,3.17039
4096,14336,8,7,50,Flash-LLM,1676.3,560.47894
4096,14336,8,7,60,SpInfer,2744.3,342.35226
4096,14336,8,7,60,cuBLAS_TC,296166.4,3.17228
4096,14336,8,7,60,Flash-LLM,1732.6,542.26007
4096,14336,8,7,70,SpInfer,2752.5,341.33334
4096,14336,8,7,70,cuBLAS_TC,295602.2,3.17834
4096,14336,8,7,70,Flash-LLM,1713.2,548.41840
4096,14336,16,7,40,SpInfer,2690.0,698.51849
4096,14336,16,7,40,cuBLAS_TC,575571.9,3.26466
4096,14336,16,7,40,Flash-LLM,1711.1,1098.14954
4096,14336,16,7,50,SpInfer,2709.5,693.50262
4096,14336,16,7,50,cuBLAS_TC,575228.9,3.26661
4096,14336,16,7,50,Flash-LLM,1709.1,1099.46558
4096,14336,16,7,60,SpInfer,2736.1,686.75446
4096,14336,16,7,60,cuBLAS_TC,575083.5,3.26744
4096,14336,16,7,60,Flash-LLM,1696.8,1107.42786
4096,14336,16,7,70,SpInfer,2714.6,692.19464
4096,14336,16,7,70,cuBLAS_TC,575278.1,3.26633
4096,14336,16,7,70,Flash-LLM,1706.0,1101.44543
4096,14336,32,7,40,SpInfer,2713.6,1384.91174
4096,14336,32,7,40,cuBLAS_TC,244.7,15355.71582
4096,14336,32,7,40,Flash-LLM,1706.0,2202.89087
4096,14336,32,7,50,SpInfer,2697.2,1393.32422
4096,14336,32,7,50,cuBLAS_TC,243.7,15420.23535
4096,14336,32,7,50,Flash-LLM,1688.6,2225.60107
4096,14336,32,7,60,SpInfer,2695.2,1394.38306
4096,14336,32,7,60,cuBLAS_TC,249.9,15041.04883
4096,14336,32,7,60,Flash-LLM,1700.9,2209.52197
4096,14336,32,7,70,SpInfer,2698.2,1392.79541
4096,14336,32,7,70,cuBLAS_TC,243.7,15420.23535
4096,14336,32,7,70,Flash-LLM,1716.2,2189.74707
8192,28672,8,7,40,SpInfer,2758.7,1362.29248
8192,28672,8,7,40,cuBLAS_TC,1167185.9,3.21979
8192,28672,8,7,40,Flash-LLM,1706.5,2202.18872
8192,28672,8,7,50,SpInfer,2794.5,1344.82080
8192,28672,8,7,50,cuBLAS_TC,1166996.5,3.22032
8192,28672,8,7,50,Flash-LLM,1705.1,2204.00708
8192,28672,8,7,60,SpInfer,2791.4,1346.30078
8192,28672,8,7,60,cuBLAS_TC,1167179.9,3.21981
8192,28672,8,7,60,Flash-LLM,1703.1,2206.57446
8192,28672,8,7,70,SpInfer,2767.9,1357.75659
8192,28672,8,7,70,cuBLAS_TC,1167368.1,3.21929
8192,28672,8,7,70,Flash-LLM,1708.5,2199.59009
8192,28672,16,7,40,SpInfer,2717.7,2765.64893
8192,28672,16,7,40,cuBLAS_TC,2308395.0,3.25603
8192,28672,16,7,40,Flash-LLM,1694.1,4436.65625
8192,28672,16,7,50,SpInfer,2733.1,2750.10571
8192,28672,16,7,50,cuBLAS_TC,2308825.2,3.25542
8192,28672,16,7,50,Flash-LLM,1692.0,4442.27832
8192,28672,16,7,60,SpInfer,2733.1,2750.10571
8192,28672,16,7,60,cuBLAS_TC,2308576.0,3.25577
8192,28672,16,7,60,Flash-LLM,1698.8,4424.53809
8192,28672,16,7,70,SpInfer,2708.5,2775.05933
8192,28672,16,7,70,cuBLAS_TC,2308705.2,3.25559
8192,28672,16,7,70,Flash-LLM,1691.1,4444.46387
8192,28672,32,7,40,SpInfer,2704.4,5558.52490
8192,28672,32,7,40,cuBLAS_TC,245.8,61166.93359
8192,28672,32,7,40,Flash-LLM,1707.3,8804.79199
8192,28672,32,7,50,SpInfer,2725.9,5514.67480
8192,28672,32,7,50,cuBLAS_TC,244.7,61422.86328
8192,28672,32,7,50,Flash-LLM,1696.5,8860.59277
8192,28672,32,7,60,SpInfer,2713.6,5539.64697
8192,28672,32,7,60,cuBLAS_TC,244.7,61422.86328
8192,28672,32,7,60,Flash-LLM,1694.0,8873.64746
8192,28672,32,7,70,SpInfer,2701.3,5564.84619
8192,28672,32,7,70,cuBLAS_TC,254.0,59193.80859
8192,28672,32,7,70,Flash-LLM,1692.6,8881.03027
11008,4096,8,7,40,SpInfer,2684.9,268.69260
11008,4096,8,7,40,cuBLAS_TC,226905.1,3.17939
11008,4096,8,7,40,Flash-LLM,1694.7,425.68701
11008,4096,8,7,50,SpInfer,2753.5,261.99777
11008,4096,8,7,50,cuBLAS_TC,230962.2,3.12354
11008,4096,8,7,50,Flash-LLM,1693.7,425.94437
11008,4096,8,7,60,SpInfer,2701.3,267.06293
11008,4096,8,7,60,cuBLAS_TC,227061.8,3.17720
11008,4096,8,7,60,Flash-LLM,1687.6,427.49515
11008,4096,8,7,70,SpInfer,2754.6,261.90036
11008,4096,8,7,70,cuBLAS_TC,226488.3,3.18524
11008,4096,8,7,70,Flash-LLM,1686.5,427.75470
11008,4096,16,7,40,SpInfer,2681.9,538.00079
11008,4096,16,7,40,cuBLAS_TC,424049.7,3.40253
11008,4096,16,7,40,Flash-LLM,1692.7,852.40411
11008,4096,16,7,50,SpInfer,2686.0,537.18030
11008,4096,16,7,50,cuBLAS_TC,421275.7,3.42493
11008,4096,16,7,50,Flash-LLM,1695.7,850.85992
11008,4096,16,7,60,SpInfer,2705.4,533.31720
11008,4096,16,7,60,cuBLAS_TC,421911.6,3.41977
11008,4096,16,7,60,Flash-LLM,1710.1,843.72693
11008,4096,16,7,70,SpInfer,2725.9,529.31030
11008,4096,16,7,70,cuBLAS_TC,420751.4,3.42920
11008,4096,16,7,70,Flash-LLM,1684.5,856.54956
11008,4096,32,7,40,SpInfer,2671.6,1080.12561
11008,4096,32,7,40,cuBLAS_TC,242.7,11890.49805
11008,4096,32,7,40,Flash-LLM,1698.8,1698.64258
11008,4096,32,7,50,SpInfer,2766.8,1042.94885
11008,4096,32,7,50,cuBLAS_TC,248.8,11596.90625
11008,4096,32,7,50,Flash-LLM,1709.1,1688.46497
11008,4096,32,7,60,SpInfer,2637.8,1093.96277
11008,4096,32,7,60,cuBLAS_TC,245.8,11741.86719
11008,4096,32,7,60,Flash-LLM,1677.3,1720.41992
11008,4096,32,7,70,SpInfer,2997.2,962.77692
11008,4096,32,7,70,cuBLAS_TC,224.3,12867.79883
11008,4096,32,7,70,Flash-LLM,1688.6,1708.94360
32000,4096,8,3,40,SpInfer,2663.4,787.38947
32000,4096,8,3,40,cuBLAS_TC,605466.6,3.46370
32000,4096,8,3,40,Flash-LLM,1696.8,1235.96851
32000,4096,8,3,50,SpInfer,2729.0,768.48029
32000,4096,8,3,50,cuBLAS_TC,606308.3,3.45889
32000,4096,8,3,50,Flash-LLM,1705.0,1230.03003
32000,4096,8,3,60,SpInfer,2694.1,778.41125
32000,4096,8,3,60,cuBLAS_TC,601337.9,3.48748
32000,4096,8,3,60,Flash-LLM,1693.7,1238.21033
32000,4096,8,3,70,SpInfer,2717.7,771.66547
32000,4096,8,3,70,cuBLAS_TC,601903.1,3.48420
32000,4096,8,3,70,Flash-LLM,1732.6,1210.40198
32000,4096,16,3,40,SpInfer,2701.3,1552.69141
32000,4096,16,3,40,cuBLAS_TC,1187920.9,3.53079
32000,4096,16,3,40,Flash-LLM,1699.8,2467.46997
32000,4096,16,3,50,SpInfer,2741.2,1530.07104
32000,4096,16,3,50,cuBLAS_TC,1187203.1,3.53293
32000,4096,16,3,50,Flash-LLM,1711.1,2451.22681
32000,4096,16,3,60,SpInfer,2713.6,1545.66040
32000,4096,16,3,60,cuBLAS_TC,1187660.9,3.53157
32000,4096,16,3,60,Flash-LLM,1696.8,2471.93701
32000,4096,16,3,70,SpInfer,2719.7,1542.16870
32000,4096,16,3,70,cuBLAS_TC,1178546.2,3.55888
32000,4096,16,3,70,Flash-LLM,1715.2,2445.37329
32000,4096,32,3,40,SpInfer,2710.5,3094.82446
32000,4096,32,3,40,cuBLAS_TC,245.8,34133.33594
32000,4096,32,3,40,Flash-LLM,1687.6,4970.87402
32000,4096,32,3,50,SpInfer,2692.1,3116.01367
32000,4096,32,3,50,cuBLAS_TC,245.8,34133.33594
32000,4096,32,3,50,Flash-LLM,1719.3,4879.09473
32000,4096,32,3,60,SpInfer,2672.6,3138.69727
32000,4096,32,3,60,cuBLAS_TC,248.8,33711.93750
32000,4096,32,3,60,Flash-LLM,1711.1,4902.45361
32000,4096,32,3,70,SpInfer,2684.9,3124.33252
32000,4096,32,3,70,cuBLAS_TC,245.8,34133.33594
32000,4096,32,3,70,Flash-LLM,1698.8,4937.91455
20480,3584,8,6,40,SpInfer,2674.7,439.08115
20480,3584,8,6,40,cuBLAS_TC,360103.9,3.26129
20480,3584,8,6,40,Flash-LLM,1694.7,692.97882
20480,3584,8,6,50,SpInfer,2642.9,444.35489
20480,3584,8,6,50,cuBLAS_TC,358707.2,3.27399
20480,3584,8,6,50,Flash-LLM,1689.6,695.07880
20480,3584,8,6,60,SpInfer,2663.4,440.93811
20480,3584,8,6,60,cuBLAS_TC,357878.8,3.28157
20480,3584,8,6,60,Flash-LLM,1688.6,695.50031
20480,3584,8,6,70,SpInfer,2657.3,441.95761
20480,3584,8,6,70,cuBLAS_TC,358303.8,3.27768
20480,3584,8,6,70,Flash-LLM,1690.6,694.65778
20480,3584,16,6,40,SpInfer,2656.3,884.25604
20480,3584,16,6,40,cuBLAS_TC,701234.2,3.34954
20480,3584,16,6,40,Flash-LLM,1684.5,1394.38293
20480,3584,16,6,50,SpInfer,2667.5,880.52209
20480,3584,16,6,50,cuBLAS_TC,701007.9,3.35062
20480,3584,16,6,50,Flash-LLM,1696.8,1384.28479
20480,3584,16,6,60,SpInfer,2672.6,878.83521
20480,3584,16,6,60,cuBLAS_TC,697481.2,3.36756
20480,3584,16,6,60,Flash-LLM,1676.3,1401.19739
20480,3584,16,6,70,SpInfer,2658.3,883.57471
20480,3584,16,6,70,cuBLAS_TC,697741.3,3.36631
20480,3584,16,6,70,Flash-LLM,1679.4,1398.63416
20480,3584,32,6,40,SpInfer,2689.0,1746.96118
20480,3584,32,6,40,cuBLAS_TC,243.7,19275.29492
20480,3584,32,6,40,Flash-LLM,1675.3,2804.10767
20480,3584,32,6,50,SpInfer,2660.4,1765.78906
20480,3584,32,6,50,cuBLAS_TC,244.7,19194.64453
20480,3584,32,6,50,Flash-LLM,1687.6,2783.68945
20480,3584,32,6,60,SpInfer,2682.9,1750.96179
20480,3584,32,6,60,cuBLAS_TC,243.7,19275.29492
20480,3584,32,6,60,Flash-LLM,1712.1,2743.73193
20480,3584,32,6,70,SpInfer,2667.5,1761.04419
20480,3584,32,6,70,cuBLAS_TC,245.8,19114.66797
20480,3584,32,6,70,Flash-LLM,1699.8,2763.56641
3584,18944,8,7,40,SpInfer,2737.2,396.88138
3584,18944,8,7,40,cuBLAS_TC,368555.0,2.94752
3584,18944,8,7,40,Flash-LLM,1700.9,638.68994
3584,18944,8,7,50,SpInfer,2695.2,403.06384
3584,18944,8,7,50,cuBLAS_TC,368652.3,2.94675
3584,18944,8,7,50,Flash-LLM,1697.8,639.84558
3584,18944,8,7,60,SpInfer,3150.8,344.77219
3584,18944,8,7,60,cuBLAS_TC,368832.5,2.94531
3584,18944,8,7,60,Flash-LLM,1697.8,639.84558
3584,18944,8,7,70,SpInfer,2729.0,398.07278
3584,18944,8,7,70,cuBLAS_TC,368664.6,2.94665
3584,18944,8,7,70,Flash-LLM,1685.5,644.51031
3584,18944,16,7,40,SpInfer,2677.8,811.36829
3584,18944,16,7,40,cuBLAS_TC,724415.5,2.99918
3584,18944,16,7,40,Flash-LLM,1699.8,1278.14941
3584,18944,16,7,50,SpInfer,2715.6,800.04828
3584,18944,16,7,50,cuBLAS_TC,724316.2,2.99959
3584,18944,16,7,50,Flash-LLM,1702.9,1275.84375
3584,18944,16,7,60,SpInfer,2686.0,808.89362
3584,18944,16,7,60,cuBLAS_TC,724236.2,2.99992
3584,18944,16,7,60,Flash-LLM,1703.9,1275.07690
3584,18944,16,7,70,SpInfer,2664.4,815.42200
3584,18944,16,7,70,cuBLAS_TC,724584.4,2.99848
3584,18944,16,7,70,Flash-LLM,1689.6,1285.89575
3584,18944,32,7,40,SpInfer,2690.0,1615.32397
3584,18944,32,7,40,cuBLAS_TC,244.7,17755.04492
3584,18944,32,7,40,Flash-LLM,1688.6,2573.35107
3584,18944,32,7,50,SpInfer,2655.2,1636.50452
3584,18944,32,7,50,cuBLAS_TC,245.8,17681.06641
3584,18944,32,7,50,Flash-LLM,1712.1,2537.95215
3584,18944,32,7,60,SpInfer,2668.5,1628.34082
3584,18944,32,7,60,cuBLAS_TC,243.7,17829.64648
3584,18944,32,7,60,Flash-LLM,1709.1,2542.51416
3584,18944,32,7,70,SpInfer,2718.7,1598.28857
3584,18944,32,7,70,cuBLAS_TC,244.7,17755.04492
3584,18944,32,7,70,Flash-LLM,1703.9,2550.15381
21504,7168,8,1,40,SpInfer,2742.3,899.34583
21504,7168,8,1,40,cuBLAS_TC,746977.2,3.30164
21504,7168,8,1,40,Flash-LLM,1696.0,1454.15735
21504,7168,8,1,50,SpInfer,2744.3,898.67468
21504,7168,8,1,50,cuBLAS_TC,747053.0,3.30131
21504,7168,8,1,50,Flash-LLM,1723.3,1431.09766
21504,7168,8,1,60,SpInfer,2753.5,895.66681
21504,7168,8,1,60,cuBLAS_TC,747068.4,3.30124
21504,7168,8,1,60,Flash-LLM,1707.2,1444.64453
21504,7168,8,1,70,SpInfer,2752.5,896.00000
21504,7168,8,1,70,cuBLAS_TC,747234.3,3.30051
21504,7168,8,1,70,Flash-LLM,1712.7,1439.94800
21504,7168,16,1,40,SpInfer,2667.5,1849.09644
21504,7168,16,1,40,cuBLAS_TC,1470256.1,3.35486
21504,7168,16,1,40,Flash-LLM,1683.4,2930.04102
21504,7168,16,1,50,SpInfer,2673.7,1844.84705
21504,7168,16,1,50,cuBLAS_TC,1463500.9,3.37034
21504,7168,16,1,50,Flash-LLM,1701.2,2899.34302
21504,7168,16,1,60,SpInfer,2732.0,1805.43335
21504,7168,16,1,60,cuBLAS_TC,1462909.9,3.37171
21504,7168,16,1,60,Flash-LLM,1700.7,2900.27051
21504,7168,16,1,70,SpInfer,2707.5,1821.82153
21504,7168,16,1,70,cuBLAS_TC,1462571.0,3.37249
21504,7168,16,1,70,Flash-LLM,1696.8,2906.88867
21504,7168,32,1,40,SpInfer,2762.8,3570.71582
21504,7168,32,1,40,cuBLAS_TC,246.8,39974.23828
21504,7168,32,1,40,Flash-LLM,1685.6,5852.40576
21504,7168,32,1,50,SpInfer,2707.5,3643.64307
21504,7168,32,1,50,cuBLAS_TC,251.9,39161.75391
21504,7168,32,1,50,Flash-LLM,1695.3,5819.15430
21504,7168,32,1,60,SpInfer,2712.6,3636.76562
21504,7168,32,1,60,cuBLAS_TC,249.9,39482.75391
21504,7168,32,1,60,Flash-LLM,1692.4,5828.83643
21504,7168,32,1,70,SpInfer,2711.6,3638.13892
21504,7168,32,1,70,cuBLAS_TC,244.7,40308.75391
21504,7168,32,1,70,Flash-LLM,1681.1,5868.33691
7168,7168,8,3,40,SpInfer,2752.5,298.66666
7168,7168,8,3,40,cuBLAS_TC,286993.4,2.86447
7168,7168,8,3,40,Flash-LLM,1709.1,481.01617
7168,7168,8,3,50,SpInfer,2742.3,299.78195
7168,7168,8,3,50,cuBLAS_TC,286837.8,2.86602
7168,7168,8,3,50,Flash-LLM,1699.8,483.62411
7168,7168,8,3,60,SpInfer,2739.2,300.11810
7168,7168,8,3,60,cuBLAS_TC,286958.6,2.86482
7168,7168,8,3,60,Flash-LLM,1717.2,478.72153
7168,7168,8,3,70,SpInfer,2715.6,302.72098
7168,7168,8,3,70,cuBLAS_TC,287254.5,2.86186
7168,7168,8,3,70,Flash-LLM,1700.9,483.33295
7168,7168,16,3,40,SpInfer,3087.4,532.54791
7168,7168,16,3,40,cuBLAS_TC,538359.8,3.05403
7168,7168,16,3,40,Flash-LLM,1685.5,975.47510
7168,7168,16,3,50,SpInfer,2713.6,605.89886
7168,7168,16,3,50,cuBLAS_TC,538401.8,3.05379
7168,7168,16,3,50,Flash-LLM,1706.0,963.76471
7168,7168,16,3,60,SpInfer,2690.0,611.20367
7168,7168,16,3,60,cuBLAS_TC,538500.1,3.05323
7168,7168,16,3,60,Flash-LLM,1701.9,966.08429
7168,7168,16,3,70,SpInfer,2691.1,610.97107
7168,7168,16,3,70,cuBLAS_TC,538687.5,3.05217
7168,7168,16,3,70,Flash-LLM,1681.4,977.85138
7168,7168,32,3,40,SpInfer,2702.3,1216.84875
7168,7168,32,3,40,cuBLAS_TC,244.7,13436.25098
7168,7168,32,3,40,Flash-LLM,1716.2,1916.02869
7168,7168,32,3,50,SpInfer,2663.4,1234.62671
7168,7168,32,3,50,cuBLAS_TC,244.7,13436.25098
7168,7168,32,3,50,Flash-LLM,1702.9,1931.00671
7168,7168,32,3,60,SpInfer,2636.8,1247.09277
7168,7168,32,3,60,cuBLAS_TC,244.7,13436.25098
7168,7168,32,3,60,Flash-LLM,1711.1,1921.76172
7168,7168,32,3,70,SpInfer,2665.5,1233.67810
7168,7168,32,3,70,cuBLAS_TC,243.7,13492.70605
7168,7168,32,3,70,Flash-LLM,1693.7,1941.51392
28672,7168,8,4,40,SpInfer,2687.0,1223.80493
28672,7168,8,4,40,cuBLAS_TC,993025.0,3.31143
28672,7168,8,4,40,Flash-LLM,1705.1,1928.54224
28672,7168,8,4,50,SpInfer,2798.6,1174.99585
28672,7168,8,4,50,cuBLAS_TC,990147.6,3.32105
28672,7168,8,4,50,Flash-LLM,1695.2,1939.75476
28672,7168,8,4,60,SpInfer,2731.0,1204.07349
28672,7168,8,4,60,cuBLAS_TC,986920.9,3.33191
28672,7168,8,4,60,Flash-LLM,1705.0,1928.61462
28672,7168,8,4,70,SpInfer,2735.1,1202.27026
28672,7168,8,4,70,cuBLAS_TC,987725.9,3.32920
28672,7168,8,4,70,Flash-LLM,1691.5,1944.01147
28672,7168,16,4,40,SpInfer,2777.1,2368.18872
28672,7168,16,4,40,cuBLAS_TC,1944431.6,3.38231
28672,7168,16,4,40,Flash-LLM,1718.1,3827.91748
28672,7168,16,4,50,SpInfer,2726.9,2411.76416
28672,7168,16,4,50,cuBLAS_TC,1944334.4,3.38248
28672,7168,16,4,50,Flash-LLM,1700.5,3867.53662
28672,7168,16,4,60,SpInfer,2712.6,2424.51050
28672,7168,16,4,60,cuBLAS_TC,1942632.4,3.38544
28672,7168,16,4,60,Flash-LLM,1708.3,3849.78735
28672,7168,16,4,70,SpInfer,2704.4,2431.85449
28672,7168,16,4,70,cuBLAS_TC,1935551.5,3.39783
28672,7168,16,4,70,Flash-LLM,1691.5,3888.09644
28672,7168,32,4,40,SpInfer,2694.1,4882.19531
28672,7168,32,4,40,cuBLAS_TC,252.9,52004.27344
28672,7168,32,4,40,Flash-LLM,1694.6,7762.09570
28672,7168,32,4,50,SpInfer,2705.4,4861.86816
28672,7168,32,4,50,cuBLAS_TC,244.7,53745.00391
28672,7168,32,4,50,Flash-LLM,1703.0,7723.44580
28672,7168,32,4,60,SpInfer,2716.7,4841.70996
28672,7168,32,4,60,cuBLAS_TC,244.7,53745.00391
28672,7168,32,4,60,Flash-LLM,1725.8,7621.76514
28672,7168,32,4,70,SpInfer,2707.5,4858.19043
28672,7168,32,4,70,cuBLAS_TC,244.7,53745.00391
28672,7168,32,4,70,Flash-LLM,1688.4,7790.48877
7168,28672,8,3,40,SpInfer,2812.9,1169.00757
7168,28672,8,3,40,cuBLAS_TC,1142189.1,2.87898
7168,28672,8,3,40,Flash-LLM,1752.6,1876.28638
7168,28672,8,3,50,SpInfer,2758.7,1192.00598
7168,28672,8,3,50,cuBLAS_TC,1141895.1,2.87972
7168,28672,8,3,50,Flash-LLM,1701.0,1933.14990
7168,28672,8,3,60,SpInfer,2793.5,1177.14954
7168,28672,8,3,60,cuBLAS_TC,1141609.5,2.88044
7168,28672,8,3,60,Flash-LLM,1692.5,1942.90894
7168,28672,8,3,70,SpInfer,2776.1,1184.53113
7168,28672,8,3,70,cuBLAS_TC,1141493.8,2.88073
7168,28672,8,3,70,Flash-LLM,1683.6,1953.13782
7168,28672,16,3,40,SpInfer,2789.4,2357.75610
7168,28672,16,3,40,cuBLAS_TC,2242990.0,2.93210
7168,28672,16,3,40,Flash-LLM,1691.7,3887.65552
7168,28672,16,3,50,SpInfer,2777.1,2368.18872
7168,28672,16,3,50,cuBLAS_TC,2243595.0,2.93131
7168,28672,16,3,50,Flash-LLM,1695.5,3878.92383
7168,28672,16,3,60,SpInfer,2765.8,2377.83325
7168,28672,16,3,60,cuBLAS_TC,2244789.2,2.92975
7168,28672,16,3,60,Flash-LLM,1748.1,3762.25830
7168,28672,16,3,70,SpInfer,2787.3,2359.48853
7168,28672,16,3,70,cuBLAS_TC,2242248.8,2.93307
7168,28672,16,3,70,Flash-LLM,1702.0,3863.97363
7168,28672,32,3,40,SpInfer,2732.0,4814.48877
7168,28672,32,3,40,cuBLAS_TC,244.7,53745.00391
7168,28672,32,3,40,Flash-LLM,1696.0,7755.50537
7168,28672,32,3,50,SpInfer,2725.9,4825.34033
7168,28672,32,3,50,cuBLAS_TC,247.8,53078.74219
7168,28672,32,3,50,Flash-LLM,1738.8,7564.67627
7168,28672,32,3,60,SpInfer,2722.8,4830.78418
7168,28672,32,3,60,cuBLAS_TC,243.7,53970.82422
7168,28672,32,3,60,Flash-LLM,1700.2,7736.38330
7168,28672,32,3,70,SpInfer,2710.5,4852.68457
7168,28672,32,3,70,cuBLAS_TC,243.7,53970.82422
7168,28672,32,3,70,Flash-LLM,1697.9,7746.73584
27648,9216,8,7,40,SpInfer,2714.6,1501.81519
27648,9216,8,7,40,cuBLAS_TC,1247694.9,3.26752
27648,9216,8,7,40,Flash-LLM,1707.5,2387.63818
27648,9216,8,7,50,SpInfer,2710.5,1504.08459
27648,9216,8,7,50,cuBLAS_TC,1247303.8,3.26854
27648,9216,8,7,50,Flash-LLM,1683.5,2421.63062
27648,9216,8,7,60,SpInfer,2715.6,1501.24890
27648,9216,8,7,60,cuBLAS_TC,1247870.0,3.26706
27648,9216,8,7,60,Flash-LLM,1736.6,2347.64478
27648,9216,8,7,70,SpInfer,2721.8,1497.85999
27648,9216,8,7,70,cuBLAS_TC,1247437.9,3.26819
27648,9216,8,7,70,Flash-LLM,1758.8,2318.04346
27648,9216,16,7,40,SpInfer,2729.0,2987.85132
27648,9216,16,7,40,cuBLAS_TC,2419224.5,3.37039
27648,9216,16,7,40,Flash-LLM,1708.2,4773.39746
27648,9216,16,7,50,SpInfer,2720.8,2996.84766
27648,9216,16,7,50,cuBLAS_TC,2414165.0,3.37745
27648,9216,16,7,50,Flash-LLM,1717.1,4748.57861
27648,9216,16,7,60,SpInfer,2697.2,3023.01587
27648,9216,16,7,60,cuBLAS_TC,2408111.0,3.38594
27648,9216,16,7,60,Flash-LLM,1686.9,4833.52246
27648,9216,16,7,70,SpInfer,2716.7,3001.36621
27648,9216,16,7,70,cuBLAS_TC,2403970.0,3.39178
27648,9216,16,7,70,Flash-LLM,1681.9,4847.86865
27648,9216,32,7,40,SpInfer,2753.5,5922.36816
27648,9216,32,7,40,cuBLAS_TC,244.7,66632.83594
27648,9216,32,7,40,Flash-LLM,1705.2,9563.45703
27648,9216,32,7,50,SpInfer,2715.6,6004.99561
27648,9216,32,7,50,cuBLAS_TC,244.7,66632.83594
27648,9216,32,7,50,Flash-LLM,1687.2,9665.57812
27648,9216,32,7,60,SpInfer,2788.4,5848.41992
27648,9216,32,7,60,cuBLAS_TC,244.7,66632.83594
27648,9216,32,7,60,Flash-LLM,1702.7,9577.65625
27648,9216,32,7,70,SpInfer,2714.6,6007.26074
27648,9216,32,7,70,cuBLAS_TC,244.7,66632.83594
27648,9216,32,7,70,Flash-LLM,1696.5,9612.52344
9216,9216,8,5,40,SpInfer,2765.8,491.33801
9216,9216,8,5,40,cuBLAS_TC,477255.7,2.84743
9216,9216,8,5,40,Flash-LLM,1708.0,795.62592
9216,9216,8,5,50,SpInfer,2722.8,499.09891
9216,9216,8,5,50,cuBLAS_TC,476659.7,2.85100
9216,9216,8,5,50,Flash-LLM,1693.7,802.36035
9216,9216,8,5,60,SpInfer,2756.6,492.98068
9216,9216,8,5,60,cuBLAS_TC,476500.0,2.85195
9216,9216,8,5,60,Flash-LLM,1700.9,798.97894
9216,9216,8,5,70,SpInfer,2744.3,495.18808
9216,9216,8,5,70,cuBLAS_TC,477366.3,2.84678
9216,9216,8,5,70,Flash-LLM,1697.8,800.42456
9216,9216,16,5,40,SpInfer,2691.1,1009.97260
9216,9216,16,5,40,cuBLAS_TC,866863.1,3.13534
9216,9216,16,5,40,Flash-LLM,1686.5,1611.54102
9216,9216,16,5,50,SpInfer,2687.0,1011.51221
9216,9216,16,5,50,cuBLAS_TC,866386.9,3.13706
9216,9216,16,5,50,Flash-LLM,1722.4,1578.00720
9216,9216,16,5,60,SpInfer,2657.3,1022.81616
9216,9216,16,5,60,cuBLAS_TC,866076.6,3.13819
9216,9216,16,5,60,Flash-LLM,1709.1,1590.29846
9216,9216,16,5,70,SpInfer,2670.6,1017.71771
9216,9216,16,5,70,cuBLAS_TC,866243.6,3.13758
9216,9216,16,5,70,Flash-LLM,1695.7,1602.78259
9216,9216,32,5,40,SpInfer,2684.9,2024.56750
9216,9216,32,5,40,cuBLAS_TC,248.8,21845.33398
9216,9216,32,5,40,Flash-LLM,1683.5,3228.96362
9216,9216,32,5,50,SpInfer,2665.5,2039.34534
9216,9216,32,5,50,cuBLAS_TC,246.8,22026.62109
9216,9216,32,5,50,Flash-LLM,1700.9,3195.91577
9216,9216,32,5,60,SpInfer,2645.0,2055.13574
9216,9216,32,5,60,cuBLAS_TC,245.8,22118.40039
9216,9216,32,5,60,Flash-LLM,1696.8,3203.63037
9216,9216,32,5,70,SpInfer,2665.5,2039.34534
9216,9216,32,5,70,cuBLAS_TC,244.7,22210.94531
9216,9216,32,5,70,Flash-LLM,1677.3,3240.79102
36864,9216,8,2,40,SpInfer,2682.9,2026.11292
36864,9216,8,2,40,cuBLAS_TC,1640222.8,3.31407
36864,9216,8,2,40,Flash-LLM,1676.2,3242.95654
36864,9216,8,2,50,SpInfer,2682.9,2026.11292
36864,9216,8,2,50,cuBLAS_TC,1635024.9,3.32461
36864,9216,8,2,50,Flash-LLM,1700.8,3195.97583
36864,9216,8,2,60,SpInfer,2689.0,2021.48364
36864,9216,8,2,60,cuBLAS_TC,1633416.1,3.32788
36864,9216,8,2,60,Flash-LLM,1691.8,3212.96216
36864,9216,8,2,70,SpInfer,3158.0,1721.27637
36864,9216,8,2,70,cuBLAS_TC,1631230.0,3.33234
36864,9216,8,2,70,Flash-LLM,1704.4,3189.25537
36864,9216,16,2,40,SpInfer,2699.3,4027.62964
36864,9216,16,2,40,cuBLAS_TC,3215871.0,3.38062
36864,9216,16,2,40,Flash-LLM,1715.8,6336.16113
36864,9216,16,2,50,SpInfer,2733.1,3977.83154
36864,9216,16,2,50,cuBLAS_TC,3206643.8,3.39035
36864,9216,16,2,50,Flash-LLM,1694.3,6416.57959
36864,9216,16,2,60,SpInfer,2712.6,4007.86426
36864,9216,16,2,60,cuBLAS_TC,3205453.0,3.39161
36864,9216,16,2,60,Flash-LLM,1699.4,6397.36816
36864,9216,16,2,70,SpInfer,2692.1,4038.35376
36864,9216,16,2,70,cuBLAS_TC,3202514.0,3.39472
36864,9216,16,2,70,Flash-LLM,1707.4,6367.51221
36864,9216,32,2,40,SpInfer,2697.2,8061.37549
36864,9216,32,2,40,cuBLAS_TC,244.7,88843.78125
36864,9216,32,2,40,Flash-LLM,1703.6,12763.25195
36864,9216,32,2,50,SpInfer,2733.1,7955.66309
36864,9216,32,2,50,cuBLAS_TC,245.8,88473.60156
36864,9216,32,2,50,Flash-LLM,1694.7,12830.49316
36864,9216,32,2,60,SpInfer,2729.0,7967.60352
36864,9216,32,2,60,cuBLAS_TC,243.7,89217.07812
36864,9216,32,2,60,Flash-LLM,1713.6,12688.88770
36864,9216,32,2,70,SpInfer,2750.5,7905.31055
36864,9216,32,2,70,cuBLAS_TC,243.7,89217.07812
36864,9216,32,2,70,Flash-LLM,1723.0,12619.60254
9216,36864,8,5,40,SpInfer,2791.4,1947.32788
9216,36864,8,5,40,cuBLAS_TC,1990409.1,2.73101
9216,36864,8,5,40,Flash-LLM,1691.7,3213.14453
9216,36864,8,5,50,SpInfer,2790.4,1948.04248
9216,36864,8,5,50,cuBLAS_TC,1991281.6,2.72981
9216,36864,8,5,50,Flash-LLM,1687.6,3220.94287
9216,36864,8,5,60,SpInfer,2746.4,1979.27527
9216,36864,8,5,60,cuBLAS_TC,1991985.1,2.72884
9216,36864,8,5,60,Flash-LLM,1696.9,3203.44946
9216,36864,8,5,70,SpInfer,2831.4,1919.86108
9216,36864,8,5,70,cuBLAS_TC,1993559.1,2.72669
9216,36864,8,5,70,Flash-LLM,1688.5,3219.29492
9216,36864,16,5,40,SpInfer,2722.8,3992.79126
9216,36864,16,5,40,cuBLAS_TC,3547751.5,3.06437
9216,36864,16,5,40,Flash-LLM,1695.5,6412.21973
9216,36864,16,5,50,SpInfer,2680.8,4055.32178
9216,36864,16,5,50,cuBLAS_TC,3549705.2,3.06269
9216,36864,16,5,50,Flash-LLM,1712.1,6349.77979
9216,36864,16,5,60,SpInfer,2716.7,4001.82153
9216,36864,16,5,60,cuBLAS_TC,3550336.0,3.06214
9216,36864,16,5,60,Flash-LLM,1716.6,6333.32666
9216,36864,16,5,70,SpInfer,2699.3,4027.62964
9216,36864,16,5,70,cuBLAS_TC,3552813.0,3.06001
9216,36864,16,5,70,Flash-LLM,1694.4,6416.09473
9216,36864,32,5,40,SpInfer,2734.1,7952.68262
9216,36864,32,5,40,cuBLAS_TC,243.7,89217.07812
9216,36864,32,5,40,Flash-LLM,1726.5,12593.63965
9216,36864,32,5,50,SpInfer,2727.9,7970.59473
9216,36864,32,5,50,cuBLAS_TC,247.8,87742.41406
9216,36864,32,5,50,Flash-LLM,1690.9,12859.14648
9216,36864,32,5,60,SpInfer,2725.9,7976.58301
9216,36864,32,5,60,cuBLAS_TC,242.7,89593.52344
9216,36864,32,5,60,Flash-LLM,1703.4,12764.69043
9216,36864,32,5,70,SpInfer,2711.6,8018.75537
9216,36864,32,5,70,cuBLAS_TC,245.8,88473.60156
9216,36864,32,5,70,Flash-LLM,1704.9,12753.19043
36864,12288,8,2,40,SpInfer,2706.4,2677.97510
36864,12288,8,2,40,cuBLAS_TC,2289389.5,3.16580
36864,12288,8,2,40,Flash-LLM,1706.2,4247.87451
36864,12288,8,2,50,SpInfer,2744.3,2641.00317
36864,12288,8,2,50,cuBLAS_TC,2289335.2,3.16588
36864,12288,8,2,50,Flash-LLM,1697.5,4269.65527
36864,12288,8,2,60,SpInfer,2724.9,2659.86011
36864,12288,8,2,60,cuBLAS_TC,2289206.2,3.16606
36864,12288,8,2,60,Flash-LLM,1702.4,4257.37646
36864,12288,8,2,70,SpInfer,2740.2,2644.95068
36864,12288,8,2,70,cuBLAS_TC,2289343.5,3.16587
36864,12288,8,2,70,Flash-LLM,1699.2,4265.47412
36864,12288,16,2,40,SpInfer,2692.1,5384.47168
36864,12288,16,2,40,cuBLAS_TC,4367217.5,3.31916
36864,12288,16,2,40,Flash-LLM,1721.5,8420.41797
36864,12288,16,2,50,SpInfer,2707.5,5353.92432
36864,12288,16,2,50,cuBLAS_TC,4362952.0,3.32241
36864,12288,16,2,50,Flash-LLM,1728.9,8384.26074
36864,12288,16,2,60,SpInfer,2710.5,5347.85645
36864,12288,16,2,60,cuBLAS_TC,4362481.5,3.32277
36864,12288,16,2,60,Flash-LLM,1706.2,8495.58984
36864,12288,16,2,70,SpInfer,2688.0,5392.67676
36864,12288,16,2,70,cuBLAS_TC,4355109.5,3.32839
36864,12288,16,2,70,Flash-LLM,1700.2,8525.81055
36864,12288,32,2,40,SpInfer,2695.2,10756.66895
36864,12288,32,2,40,cuBLAS_TC,244.7,118458.37500
36864,12288,32,2,40,Flash-LLM,1704.8,17005.21289
36864,12288,32,2,50,SpInfer,2697.2,10748.50098
36864,12288,32,2,50,cuBLAS_TC,244.7,118458.37500
36864,12288,32,2,50,Flash-LLM,1685.4,17200.86719
36864,12288,32,2,60,SpInfer,2680.8,10814.19141
36864,12288,32,2,60,cuBLAS_TC,245.8,117964.80469
36864,12288,32,2,60,Flash-LLM,1679.7,17259.19531
36864,12288,32,2,70,SpInfer,2681.9,10810.06250
36864,12288,32,2,70,cuBLAS_TC,249.9,116030.94531
36864,12288,32,2,70,Flash-LLM,1695.4,17100.22070
12288,12288,8,6,40,SpInfer,2694.1,896.72980
12288,12288,8,6,40,cuBLAS_TC,781373.4,3.09189
12288,12288,8,6,40,Flash-LLM,1712.2,1411.00940
12288,12288,8,6,50,SpInfer,2727.9,885.62164
12288,12288,8,6,50,cuBLAS_TC,781533.2,3.09126
12288,12288,8,6,50,Flash-LLM,1713.5,1409.92908
12288,12288,8,6,60,SpInfer,2693.1,897.07074
12288,12288,8,6,60,cuBLAS_TC,781425.6,3.09168
12288,12288,8,6,60,Flash-LLM,1696.4,1424.10449
12288,12288,8,6,70,SpInfer,2706.4,892.65833
12288,12288,8,6,70,cuBLAS_TC,781333.5,3.09205
12288,12288,8,6,70,Flash-LLM,1694.8,1425.47571
12288,12288,16,6,40,SpInfer,2699.3,1790.05762
12288,12288,16,6,40,cuBLAS_TC,1553187.9,3.11092
12288,12288,16,6,40,Flash-LLM,1707.4,2829.89941
12288,12288,16,6,50,SpInfer,2735.1,1766.60120
12288,12288,16,6,50,cuBLAS_TC,1553163.1,3.11097
12288,12288,16,6,50,Flash-LLM,1719.9,2809.41724
12288,12288,16,6,60,SpInfer,2686.0,1798.92944
12288,12288,16,6,60,cuBLAS_TC,1553315.8,3.11066
12288,12288,16,6,60,Flash-LLM,1697.2,2847.02734
12288,12288,16,6,70,SpInfer,2691.1,1795.50684
12288,12288,16,6,70,cuBLAS_TC,1553127.4,3.11104
12288,12288,16,6,70,Flash-LLM,1706.3,2831.81006
12288,12288,32,6,40,SpInfer,2693.1,3588.28296
12288,12288,32,6,40,cuBLAS_TC,244.7,39486.12500
12288,12288,32,6,40,Flash-LLM,1713.1,5640.98047
12288,12288,32,6,50,SpInfer,2692.1,3589.64795
12288,12288,32,6,50,cuBLAS_TC,247.8,38996.62891
12288,12288,32,6,50,Flash-LLM,1687.7,5726.01221
12288,12288,32,6,60,SpInfer,2678.8,3607.48633
12288,12288,32,6,60,cuBLAS_TC,245.8,39321.60156
12288,12288,32,6,60,Flash-LLM,1709.9,5651.53711
12288,12288,32,6,70,SpInfer,2672.6,3615.77905
12288,12288,32,6,70,cuBLAS_TC,243.7,39652.03516
12288,12288,32,6,70,Flash-LLM,1683.5,5740.16162
49152,12288,8,3,40,SpInfer,2718.7,3554.49512
49152,12288,8,3,40,cuBLAS_TC,2949999.5,3.27582
49152,12288,8,3,40,Flash-LLM,1700.6,5682.59033
49152,12288,8,3,50,SpInfer,2677.8,3608.86597
49152,12288,8,3,50,cuBLAS_TC,2949740.5,3.27611
49152,12288,8,3,50,Flash-LLM,1709.2,5653.86475
49152,12288,8,3,60,SpInfer,2682.9,3601.97852
49152,12288,8,3,60,cuBLAS_TC,2947001.5,3.27916
49152,12288,8,3,60,Flash-LLM,1704.9,5668.29785
49152,12288,8,3,70,SpInfer,2700.3,3578.75757
49152,12288,8,3,70,cuBLAS_TC,2948539.2,3.27745
49152,12288,8,3,70,Flash-LLM,1689.4,5720.15576
49152,12288,16,3,40,SpInfer,2987.0,6470.47217
49152,12288,16,3,40,cuBLAS_TC,5815028.5,3.32369
49152,12288,16,3,40,Flash-LLM,1700.8,11363.89746
49152,12288,16,3,50,SpInfer,2737.2,7061.11768
49152,12288,16,3,50,cuBLAS_TC,5815215.0,3.32358
49152,12288,16,3,50,Flash-LLM,1685.2,11469.20410
49152,12288,16,3,60,SpInfer,2707.5,7138.56592
49152,12288,16,3,60,cuBLAS_TC,5797406.5,3.33379
49152,12288,16,3,60,Flash-LLM,1699.0,11375.45410
49152,12288,16,3,70,SpInfer,2723.8,7095.62695
49152,12288,16,3,70,cuBLAS_TC,5796638.5,3.33423
49152,12288,16,3,70,Flash-LLM,1684.4,11474.21484
49152,12288,32,3,40,SpInfer,2717.7,14223.33691
49152,12288,32,3,40,cuBLAS_TC,244.7,157944.50000
49152,12288,32,3,40,Flash-LLM,1720.3,22469.90234
49152,12288,32,3,50,SpInfer,2724.9,14185.92090
49152,12288,32,3,50,cuBLAS_TC,244.7,157944.50000
49152,12288,32,3,50,Flash-LLM,1698.2,22761.62695
49152,12288,32,3,60,SpInfer,2751.5,14048.65527
49152,12288,32,3,60,cuBLAS_TC,244.7,157944.50000
49152,12288,32,3,60,Flash-LLM,1692.5,22838.22852
49152,12288,32,3,70,SpInfer,2706.4,14282.53320
49152,12288,32,3,70,cuBLAS_TC,244.7,157944.50000
49152,12288,32,3,70,Flash-LLM,1702.7,22702.16602
12288,49152,8,6,40,SpInfer,2746.4,3518.71167
12288,49152,8,6,40,cuBLAS_TC,2981271.5,3.24146
12288,49152,8,6,40,Flash-LLM,1701.2,5680.55908
12288,49152,8,6,50,SpInfer,2758.7,3503.03784
12288,49152,8,6,50,cuBLAS_TC,2981384.2,3.24134
12288,49152,8,6,50,Flash-LLM,1699.0,5687.72705
12288,49152,8,6,60,SpInfer,2740.2,3526.60107
12288,49152,8,6,60,cuBLAS_TC,2981878.8,3.24080
12288,49152,8,6,60,Flash-LLM,1703.9,5671.49121
12288,49152,8,6,70,SpInfer,2798.6,3453.04907
12288,49152,8,6,70,cuBLAS_TC,2981881.0,3.24080
12288,49152,8,6,70,Flash-LLM,1708.8,5655.34717
12288,49152,16,6,40,SpInfer,2748.4,7032.17871
12288,49152,16,6,40,cuBLAS_TC,5940734.0,3.25336
12288,49152,16,6,40,Flash-LLM,1718.7,11245.62109
12288,49152,16,6,50,SpInfer,2732.0,7074.35107
12288,49152,16,6,50,cuBLAS_TC,5939221.0,3.25419
12288,49152,16,6,50,Flash-LLM,1718.4,11247.50488
12288,49152,16,6,60,SpInfer,2705.4,7143.96973
12288,49152,16,6,60,cuBLAS_TC,5932367.0,3.25795
12288,49152,16,6,60,Flash-LLM,1714.1,11275.22070
12288,49152,16,6,70,SpInfer,2694.1,7173.83838
12288,49152,16,6,70,cuBLAS_TC,5923513.5,3.26282
12288,49152,16,6,70,Flash-LLM,1688.4,11447.03223
12288,49152,32,6,40,SpInfer,2776.1,13924.28516
12288,49152,32,6,40,cuBLAS_TC,245.8,157286.40625
12288,49152,32,6,40,Flash-LLM,1700.3,22734.63867
12288,49152,32,6,50,SpInfer,2732.0,14148.70215
12288,49152,32,6,50,cuBLAS_TC,245.8,157286.40625
12288,49152,32,6,50,Flash-LLM,1696.9,22779.65625
12288,49152,32,6,60,SpInfer,2692.1,14358.59180
12288,49152,32,6,60,cuBLAS_TC,251.9,153450.14062
12288,49152,32,6,60,Flash-LLM,1691.7,22849.02734
12288,49152,32,6,70,SpInfer,2709.5,14266.33984
12288,49152,32,6,70,cuBLAS_TC,244.7,157944.50000
12288,49152,32,6,70,Flash-LLM,1710.7,22595.57812
